제목,링크,출처,날짜,설명
Ravensthorpe mine is true boom and bust story,https://thewest.com.au/business/lithium/ravensthorpe-nickel-mine-is-wa-minings-bellwether-c-13229889,2024. 1. 14.,날짜 없음,"Opened at a cost of $2.2 billion by BHP in 2008, the south coast mine was mothballed just eight months later with the loss of 1800 jobs after nickel prices..."
Columbia Gas raised your rates while nickel and diming employees. They are standing up.,https://www.dispatch.com/story/opinion/columns/guest/2024/01/13/why-are-columbia-gas-employees-unionizing-ohio-rate-hikes/72085411007/,2024. 1. 13.,날짜 없음,"Columbia Gas is taking harmful, profit-maximizing steps while nickel and diming workers, Eddie Hall writes."
The eight mines most at risk of closure amid a battery metals slump,https://www.afr.com/companies/mining/the-eight-mines-most-at-risk-of-closure-amid-a-battery-metals-slump-20240109-p5evzc,2024. 1. 9.,날짜 없음,"The boom in battery metal prices has turned to bust, prompting closure of high-cost Australian lithium and nickel operations. Could these be the next to..."
Panoramic suspends mining at Savannah nickel mine,https://www.sharecafe.com.au/2024/01/09/panoramic-suspends-mining-at-savannah-nickel-mine/,2024. 1. 9.,날짜 없음,Around 140 jobs will be lost after the administrators of Panoramic Resources decided to suspend mining at the company's troubled Savannah nickel mine in...
Downturn behind WA minesite slashing 30 per cent of jobs,https://thewest.com.au/business/mining/jobs-to-go-at-ravensthorpe-as-first-quantum-minerals-suspends-operations-at-nickel-mine--c-13229587,2024. 1. 14.,날짜 없음,Canadian miner First Quantum Minerals will cease mining and slash the workforce of its Ravensthorpe nickel mine in WA's southeast by about 30 per cent.
5 Best Nickel Stocks to Invest in 2024,https://coincodex.com/article/26739/best-nickel-stocks/,2024. 1. 11.,날짜 없음,The best nickel stocks: Explore 5 leading nickel mining companies. 1. Rio Tinto (RIO). 2. Anglo American (NGLOY). 3. Vale S.A. (VALE).
"Oversupply continues to put pressure on NPI, MHP markets in 2024 | 2024 preview",https://www.fastmarkets.com/insights/oversupply-continues-to-put-pressure-on-npi-mhp-markets-in-2024-2024-preview/,2024. 1. 18.,날짜 없음,"Almost all nickel products, including nickel pig iron (NPI), have been facing persistent pressure from oversupplied market conditions, sources have told..."
Nickel Price Crash Seen Strengthening Indonesia’s Grip on Global Supply,https://www.bloomberg.com/news/articles/2024-01-22/nickel-price-crash-seen-strengthening-indonesia-s-grip-on-supply,2024. 1. 22.,날짜 없음,Nickel Price Crash Seen Extending Indonesia's Grip on Supply ... This article is for subscribers only. A prolonged slump in nickel prices is stress-testing...
BHP faces nickel choice this year as high-cost Australian miners suffer,https://www.reuters.com/markets/commodities/bhp-faces-nickel-choice-this-year-high-cost-australian-miners-suffer-2024-01-17/,2024. 1. 16.,날짜 없음,"Australian nickel producers, hit by a sharp jump in supply from rival Indonesia, are starting to buckle under low prices that analysts expect will force a..."
Nickel price: Andrew Forrest shuts mines as nickel dominoes tumble,https://www.afr.com/companies/mining/forrest-shuts-wa-mines-as-nickel-dominoes-tumble-20240121-p5eyvo,2024. 1. 22.,날짜 없음,Andrew Forrest faces another nickel nightmare as a price plunge triggers the shutdown of WA mines his private company Wyloo acquired for $760 million just...
South32’s Colombia nickel mine faces strategic review amid market turbulence,https://www.miningweekly.com/article/south32s-colombia-nickel-mine-faces-strategic-review-amid-market-turbulence-2024-01-22,2024. 1. 22.,날짜 없음,"The Cerro Matoso mine, in Colombia, a major ferronickel producer, is undergoing a strategic review in response to ongoing nickel market shifts that are putting..."
The Price of Indonesia’s Nickel Profits,https://pulitzercenter.org/stories/price-indonesias-nickel-profits,2024. 1. 20.,날짜 없음,"Thanks to its flourishing nickel smelting and downstreaming activities, the northeastern province recorded a whopping increase in regional gross domestic..."
Indonesian Nickel Miners Face Plummeting Prices and Oversupply Concerns,https://jakartaglobe.id/business/indonesian-nickel-miners-face-plummeting-prices-and-oversupply-concerns,2024. 1. 23.,날짜 없음,"Indonesian miners are grappling with the decreasing nickel prices, approaching their lowest level since 2021."
Metal prices to ease with softening demand,https://blogs.worldbank.org/en/opendata/metal-prices-ease-softening-demand,2024. 1. 17.,날짜 없음,"Metal prices are forecast to fall by 5 percent in 2024, before stabilizing in 2025, according to the Word Bank's Metal Price Index."
Challenges for High-Cost Australian Miners Put BHP in Spotlight for Nickel Decision,https://www.chemanalyst.com/NewsAndDeals/NewsDetails/challenges-for-high-cost-australian-miners-put-bhp-in-spotlight-for-nickel-decision-24627,2024. 1. 18.,날짜 없음,Challenges for High-Cost Australian Miners Put BHP in Spotlight for Nickel Decision ... Australian nickel producers are grappling with the challenges posed by a...
Australian tycoon Forrest shuts nickel mines after prices crash,https://www.mining.com/web/australian-tycoon-forrest-shuts-nickel-mines-after-prices-crash/,2024. 1. 21.,날짜 없음,"Australian tycoon Forrest shuts nickel mines after prices crash ... The Kambalda nickel concentrator. (Source: BHP.) Wyloo Metals Pty Ltd., the private nickel..."
BHP looks at cost cuts as nickel prices dive,https://www.smh.com.au/business/companies/bhp-looks-at-cost-cuts-as-nickel-prices-dive-20240118-p5ey83.html,2024. 1. 18.,날짜 없음,"In the three months to December, the price of nickel fell 17 per cent to $US16,812 a tonne, leading BHP to cut costs reassess the carrying value of the business..."
What is Nickel Used For? (Updated 2024),https://investingnews.com/daily/resource-investing/base-metals-investing/nickel-investing/nickel-applications/,2024. 1. 23.,날짜 없음,What are the main applications of nickel? The base metal's diverse uses and expanding role in the battery sector are making it increasingly appealing for...
Australia’s ‘white gold’ was supposed to fuel the EV transition – then prices for battery minerals collapsed,https://www.theguardian.com/environment/2024/jan/20/australia-white-gold-ev-transition-battery-minerals-lithium-nickel-cobalt,2024. 1. 19.,날짜 없음,"Why have lithium, nickel and cobalt markets slumped despite the demand for electric vehicles? And what happens next?"
Andrew Forrest's Wyloo Metals to shutter Kambalda nickel mines after prices slump,https://www.abc.net.au/news/2024-01-22/andrew-forrest-company-to-close-kambalda-nickel-mines-wa/103375250,2024. 1. 21.,날짜 없음,"Billionaire Andrew Forrest's Wyloo Metals has confirmed its Kambalda nickel mines will be placed in care and maintenance mode by May 31, with prices for the..."
Nickel's Nosedive: 40% Yearly Drop Puts Miners In A Tight Spot,https://www.nasdaq.com/articles/nickels-nosedive:-40-yearly-drop-puts-miners-in-a-tight-spot,2024. 1. 23.,날짜 없음,"Nickel prices on the London Metal Exchange (LME) have continued their downward spiral, marking a more than 40% decline over the past year."
Surging exchange stocks pile the pressure on nickel,https://www.reuters.com/markets/commodities/surging-exchange-stocks-pile-pressure-nickel-2024-01-17/,2024. 1. 18.,날짜 없음,Nickel was the worst performer among the London Metal Exchange's (LME) base metals last year by some margin as the market priced in a wave of new Indonesian...
What’s ahead for the base metals market? | 2024 preview,https://www.fastmarkets.com/insights/whats-ahead-for-the-base-metals-market-2024-preview/,2024. 1. 22.,날짜 없음,The new year has got off to a relatively weak start for the base metals with London Metal Exchange prices generally lower in January.
Forrest’s nickel closure forces BHP to shut WA processing plant,https://www.smh.com.au/business/companies/forrest-the-next-to-close-wa-nickel-mines-as-price-slumps-20240122-p5ez5f.html,2024. 1. 22.,날짜 없음,Andrew Forrest's Wyloo Metals in the latest nickel miner to shut down its West Australian operations due to low prices for the key steel and battery ingredient.
Lithium and nickel: BHP’s warning on battery minerals is striking,https://www.afr.com/chanticleer/bhp-s-warning-on-battery-minerals-is-striking-20240118-p5eyb3,2024. 1. 18.,날짜 없음,Demand from the energy transition was supposed to underpin strong prices for nickel and lithium. But the battery minerals slump appears to be entering a new...
London Metal Exchange bounces back from nickel debacle,https://www.reuters.com/markets/commodities/london-metal-exchange-bounces-back-nickel-debacle-2024-01-19/,2024. 1. 21.,날짜 없음,The London Metal Exchange (LME) is showing signs of a full recovery from its nickel debacle in 2022.
"South32 misses output estimates, puts Colombia nickel unit under review",https://www.mining.com/web/south32-misses-output-estimates-puts-colombia-nickel-unit-under-review/,2024. 1. 21.,날짜 없음,Australian miner South32 logged an unexpectedly sharp drop in metallurgical coal production and put its nickel operations under review.
Ravensthorpe a reminder of cyclical price fluctuations,https://mining.com.au/ravensthorpe-closure-a-reminder-of-cyclical-price-fluctuations/,2024. 1. 17.,날짜 없음,The subdued nickel market and suspension of mining at Canada's First Quantum Minerals' (TSE:FM) Ravensthorpe Nickel Mine in Western Australia highlights the...
Ground Breakers: Those Game of Thrones nickel jokes are looking REALLY dated now,https://stockhead.com.au/resources/ground-breakers-those-game-of-thrones-nickel-jokes-are-looking-really-dated-now/,2024. 1. 23.,날짜 없음,"The growth of Australia's battery-powered Australia's nickel industry has been stopped in its tracks, and so have its Game of Thrones memes."
"ChartWatch: Iron Ore vs BHP, RIO & FMG, Copper vs SFR, Nickel vs IGO & NIC, Lithium vs PLS & MIN",https://www.marketindex.com.au/news/chartwatch-iron-ore-vs-bhp-rio-and-fmg-copper-vs-sfr-nickel-vs-igo-and-nic,2024. 1. 19.,날짜 없음,Key industrial metals prices are sliding on global economic growth concerns and slowing Chinese economic growth. A timely in-depth look at the charts of...
BHP shuts down WA nickel processing plant,https://www.australianmining.com.au/bhp-shuts-down-wa-nickel-processing-plant/,2024. 1. 23.,날짜 없음,"Following Wyloo's decision to place the Cassini, Long and Durkin nickel mines under care and maintenance, BHP has announced that it will pause part of its..."
Hopetoun residents say job cuts at First Quantum Minerals' Ravensthorpe nickel mine a blow to town,https://www.abc.net.au/news/2024-01-17/hopetoun-locals-brace-for-job-losses-mine-closure/103333396,2024. 1. 16.,날짜 없음,"Sam Foulds is used to seeing faces come and go, as the size of his town fluctuates with the price of nickel. Key points:."
Will the crash in critical minerals derail the clean energy transition?,https://www.abc.net.au/news/2024-01-23/will-critical-minerals-crash-derail-clean-energy-transition/103377090,2024. 1. 22.,날짜 없음,"The sudden evaporation of hype and hot air in the energy transition industry may leave many who plunged into critical minerals in a critical condition,..."
"Albemarle, BHP hit by collapse in battery mineral prices",https://www.afr.com/companies/mining/albemarle-ditches-lithium-project-bhp-bows-to-nickel-woes-20240118-p5ey5z,2024. 1. 18.,날짜 없음,The collapse in prices for battery minerals has forced the US lithium giant to cut a West Australian project. BHP warned its nickel division would not be...
FQM to reduce mining at Ravensthorpe,https://www.australianmining.com.au/fqm-to-reduce-mining-at-ravensthorpe/,2024. 1. 16.,날짜 없음,First Quantum Minerals (FQM) will scale back its operations at its Ravensthorpe nickel mine in Western Australia.
First Quantum to halt mining at Ravensthorpe and cut 30% staff,https://www.mining-technology.com/news/first-quantum-to-halt-mining/,2024. 1. 16.,날짜 없음,FQM has announced a significant reduction in operating activities at its Ravensthorpe Nickel Operation (RNO) in Western Australia (WA).
What the current critical minerals crisis means for your shares,https://www.theaustralian.com.au/business/mining-energy/january-is-the-killing-season-for-critical-minerals-market-darlings-as-more-projects-face-the-axe-in-lithium-and-nickel/news-story/d6724f9788f44c1c6c6da0562b4cac33,2024. 1. 22.,날짜 없음,"Liontown, Chalice, South32 and Wyloo all announced pullbacks in response to tumbling prices for battery and clean energy metals on Monday."
Andrew Forrest the new victim of nickel price agony,https://thewest.com.au/business/mining/andrew-forrest-pulls-the-pin-on-nickel-operation-placing-mines-near-kambalda-into-care-and-maintenance-c-13304809,2024. 1. 21.,날짜 없음,"Twiggy's latest foray into Australian nickel mining has proved to be short-lived, with the billionaire set to shut down WA mines purchased six months ago..."
Wyloo shuts down WA nickel mines,https://www.australianmining.com.au/wyloo-shuts-down-wa-nickel-mines-in-light-of-recent-woes/,2024. 1. 22.,날짜 없음,Wyloo will temporarily shut down the Western Australian nickel mines it obtained through its acquisition of Mincor Resources.
Critics skewer Indonesian president’s VP candidate son for ‘arrogant’ antics during debate,https://www.benarnews.org/english/news/indonesian/vp-candidate-gibran-slammed-for-arrogant-antics-01222024132635.html,2024. 1. 22.,날짜 없음,"Social media users on Monday criticized Gibran Rakabuming Raka, the Indonesian president's eldest son and a vice-presidential hopeful, for coming across as..."
S32 ASX: Nickel glut prompts rethink for South32’s Colombian mine,https://www.afr.com/companies/mining/nickel-glut-prompts-rethink-for-south32-s-colombian-mine-20240119-p5eyj8,2024. 1. 21.,날짜 없음,"Davos, Switzerland | Mining company South32 is scrambling to retool its Colombian nickel mine in response to an Indonesia-fuelled glut that has sent..."
Top 50 Most Valuable Nickels,https://www.gainesvillecoins.com/blog/most-valuable-nickels,2024. 1. 23.,날짜 없음,"This is a list of the 50 most expensive U.S. nickel coins, as ranked by numismatic experts. These are the most popular rare nickels by auction records."
China’s refined nickel export volume soars in 2023,https://www.fastmarkets.com/insights/chinas-refined-nickel-export-volume-soars-in-2023/,2024. 1. 26.,날짜 없음,"Read more about how the volume of refined nickel exported by China soared in 2023, official customs data released on Monday January 22 shows,..."
New Caledonia’s Prony Resources faces cash crunch on nickel slump,https://www.mining.com/web/new-caledonias-prony-resources-faces-cash-crunch-on-nickel-slump/,2024. 1. 24.,날짜 없음,Companies in other high-cost nickel-producing regions have announced restructurings and writedowns as prices have dropped.
"What's behind the drastic downturn in nickel and lithium prices, and what does it mean?",https://www.abc.net.au/news/2024-01-26/examining-the-drastic-downturn-in-nickel-and-lithium-prices/103388902,2024. 1. 25.,날짜 없음,"The price of lithium has dropped by more than 80 per cent. Meanwhile, nickel is down more than 40 per cent. The plummeting prices have pushed WA's major..."
Indonesia’s flood of nickel sparks ‘Darwinian’ battle for survival among miners,https://www.ft.com/content/dd9434b4-04e5-474d-85ff-7149f89efd19,2024. 1. 29.,날짜 없음,"Indonesia is flooding the global nickel market with low-cost supplies, forcing rivals to shut unprofitable mines and sowing panic in Washington and Paris."
US Stainless-Steel CR Coil Prices remain plunge amid weak downstream Market purchases,https://www.chemanalyst.com/NewsAndDeals/NewsDetails/us-stainless-steel-cr-coil-prices-remain-plunge-amid-weak-downstream-market-purchases-24805,2024. 1. 29.,날짜 없음,"In the first half of January 2024, the Stainless-Steel CR Coil experienced a severely declining trend in the US spot market as the demand from the..."
Nickel miners explore for taxpayer dime to ease industry pain,https://www.watoday.com.au/national/western-australia/nickel-miners-explore-for-taxpayer-dime-to-ease-industry-pain-20240125-p5f014.html,2024. 1. 25.,날짜 없음,WA's troubled nickel sector is pleading for government help to withstand a price slump caused by booming production from Indonesia.
Bahlil Denies Nickel Being Less Popular Than LFP Batteries,https://jakartaglobe.id/business/bahlil-denies-nickel-being-less-popular-than-lfp-batteries,2024. 1. 24.,날짜 없음,"Nickel-based batteries are still not losing popularity to lithium ferro-phosphate (LFP) in the electric vehicle (EV) market, according to Investment Minister..."
Indonesian nickel miner boosts returns as mines fight to survive,https://www.afr.com/companies/mining/indo-nickel-miner-boosts-dividend-as-aussie-rivals-fight-to-survive-20240130-p5f119,2024. 1. 30.,날짜 없음,Nickel Industries will pay a final dividend of 2.5¢ and buy back up to $US100 million ($151 million) despite the price plunge that prompted crisis talks.
"Indonesian nickel boom claims another WA mine, and hundreds of jobs",https://www.smh.com.au/business/companies/indonesian-nickel-boom-claims-another-wa-mine-and-hundreds-of-jobs-20240131-p5f1c0.html,2024. 1. 31.,날짜 없음,Battery minerals specialist IGO will close its Cosmos nickel mine in Western Australia's Goldfields region at the cost of about 400 jobs.
Hydromet Technology: A game-changer for Kabanga,https://www.miningreview.com/east-africa/hydromet-technology-a-game-changer-for-kabanga/,2024. 1. 29.,날짜 없음,"Hydromet Technology is the brainchild of Keith Liddell, Keith Liddell, a Tembo Nickel geologist, and Dr. Mike Adams, Lifezone's CTO."
"Sibanye-Stillwater to decide on fate of nickel refinery, Sandouville",https://www.miningmx.com/news/base-metals/55527-sibanye-stillwater-to-decide-on-fate-of-nickel-refinery-sandouville/,2024. 1. 24.,날짜 없음,Sibanye-Stillwater will next month complete a study that will decide the future of its Sandouville nickel refinery open amid a drastic decline in the metal's...
Breakingviews - Indonesia's nickel policy looks fragile,https://www.reuters.com/breakingviews/indonesias-nickel-policy-looks-fragile-2024-01-26/,2024. 1. 26.,날짜 없음,Indonesia's road to conquering the global electric-vehicle supply chain is getting bumpy ahead of elections next month. Outgoing President Joko Widodo's...
"Australia's EV battery metals industry faces Indonesia, China challenges",https://asia.nikkei.com/Spotlight/Market-Spotlight/Australia-s-EV-battery-metals-industry-faces-Indonesia-China-challenges,2024. 1. 29.,날짜 없음,A prolonged slump in the price of metals used in electric vehicle batteries has spotlighted the challenges Australia faces in its quest to become a key player...
"Australian mining group pushes govt for tax credit as lithium, nickel prices slump",https://www.miningweekly.com/article/australian-mining-group-pushes-govt-for-tax-credit-as-lithium-nickel-prices-slump-2024-01-25,2024. 1. 25.,날짜 없음,"In response, Australia should introduce a 10% production tax credit (PTC) for downstream producers to save jobs and preserve the country's ambitions of becoming..."
Nickel miners could pay less to mine in Western Australia amid royalty relief crisis talks,https://www.abc.net.au/news/2024-01-25/nickel-miners-pay-less-to-mine-in-western-australia-amid-crisis/103390830,2024. 1. 25.,날짜 없음,"Nickel miners could pay less to mine in WA, as the government holds crisis talks with the resources industry as mines shut and hundreds of jobs are lost."
Trafigura-backed nickel mine seeks new partner for bailout,https://www.mining.com/web/trafigura-backed-nickel-mine-seeks-new-partner-for-bailout/,2024. 1. 31.,날짜 없음,A major nickel operation backed by Trafigura Group will need support from a new investor after the trading giant declined to contribute more funds.
Australia Seeks to Work with Indonesia on ESG As Nickel Price Drops,https://jakartaglobe.id/business/australia-seeks-to-work-with-indonesia-on-esg-as-nickel-price-drops,2024. 1. 26.,날짜 없음,An Australian government official on Friday suggested cooperation with Indonesia to improve the environmental and labor standards of the resources sector.
High stainless steel output in China led to jump in imports of raw materials in 2023,https://www.fastmarkets.com/insights/high-stainless-steel-output-in-china-led-to-jump-in-raw-material-imports/,2024. 1. 25.,날짜 없음,"Take a look at how stainless steel production in China has impacted chrome ore, ferro-chrome, nickel pig iron (NPI) and ferro-nickel imports."
"IGO freezes nickel project, trims lithium forecast",https://www.mining.com/web/igo-puts-cosmos-nickel-mine-on-care-and-maintenance/,2024. 1. 30.,날짜 없음,"IGO Ltd said on Wednesday it would put its Cosmos nickel project in Western Australia into care and maintenance due to low prices, as it also trimmed its..."
Luhut Counters Tom Lembong's Statements on Tesla's Nickel Transition,https://jakartaglobe.id/news/luhut-counters-tom-lembongs-statements-on-teslas-nickel-transition,2024. 1. 25.,날짜 없음,Luhut Binsar Pandjaitan has refuted assertions made by the former head of the BKPM Thomas Lembong on the nickel industry.
IGO shelves its Cosmos nickel project – but why is the stock clawing back losses?,https://www.marketindex.com.au/news/igo-shelves-its-cosmos-nickel-project-but-why-is-the-stock-clawing-back,2024. 1. 31.,날짜 없음,IGO's (ASX: IGO) Cosmos Project is the latest WA nickel mine to shut down due to spiraling costs and depressed prices for the key steelmaking and battery...
Cosmos shuttered as nickel price bites harder,https://www.miningmonthly.com/underground/news-articles/1464236/cosmos-canned-nickel-price-bites-harder,2024. 1. 31.,날짜 없음,Cosmos shuttered as nickel price bites harder. Delays the development of a fully electric underground mine in Australia.
Another nickel mine to go amid IGO woes,https://www.theaustralian.com.au/business/mining-energy/partners-in-the-massive-greenbushes-lithium-mine-are-holding-onto-cash-as-igo-closes-another-nickel-mine/news-story/d41abee151b1a0ac0a29e537567b7215,2024. 1. 31.,날짜 없음,"The beleaguered nickel sector has been hit with another mine closure and the loss of another 400 jobs, with IGO to mothball is under-construction Cosmos..."
Weaker-than-expected EV sales prompt Australia’s biggest lithium miner to cut production,https://www.theguardian.com/australia-news/2024/jan/31/australia-ev-sales-figures-lithium-prices-greenbushes-perth,2024. 1. 30.,날짜 없음,"The joint venture partner in Australia's largest lithium mine is reducing production of the important battery mineral, and halting one of its nickel operations."
"IGO's revenue drops 28% on soft nickel prices, Cosmos put on care and maintenance",https://www.kitco.com/news/article/2024-01-31/igos-revenue-drops-28-soft-nickel-prices-cosmos-put-care-and-maintenance,2024. 1. 31.,날짜 없음,Kitco News - Australian nickel and lithium miner IGO (ASX: IGO) said today its sales revenue dropped 28% quarter-on-quarter due to lower metal prices.
IGO to Suspend Cosmos Nickel Mine; Flags Writedowns of Up to $125 Million,https://www.wsj.com/finance/commodities-futures/igo-to-suspend-cosmos-nickel-mine-flags-writedowns-of-up-to-125-million-37edd360,2024. 1. 30.,날짜 없음,IGO said Wednesday it will suspend the Cosmos nickel mine in Western Australia following a sharp fall in prices for the metal.
"Gov’t foresees dimes from mining, but miners espy nickel",https://business.inquirer.net/443028/govt-foresees-dimes-from-mining-but-miners-espy-nickel,2024. 1. 29.,날짜 없음,The government is convinced that the Philippine mining sector will continue to sustain the growth momentum it exhibited in the previous year.
New Caledonia's Prony Resources faces cash crunch on nickel slump,http://www.thejakartapost.com/business/2024/01/28/new-caledonias-prony-resources-faces-cash-crunch-on-nickel-slump.html,2024. 1. 28.,날짜 없음,"ew Caledonian nickel producer Prony Resources is facing an ""alarming"" situation amid a slump in metal prices as it waits for the possibility France will..."
Iron ore: Wild swings in commodity prices may temper dividend outlook,https://www.afr.com/markets/equity-markets/wild-swings-in-commodity-prices-may-temper-dividend-outlook-20231211-p5eqiu,2024. 1. 29.,날짜 없음,"While shareholder payouts are expected to hold steady this reporting season, some investors are more cautious on the miners and banks."
Christopher Niesche: Lithium bloodbath hits billionaires,https://www.nzherald.co.nz/business/business-reports/sustainable-business-finance/lithium-price-plunge-catches-out-billionaires-and-smaller-investors-alike-christopher-niesche/4EKL3SU355BVFLZNRY5IYOC4ZA/,2024. 1. 27.,날짜 없음,"Everyone from billionaires to mum and dad investors has been betting big on Australian miners of lithium , nickel, cobalt, rare earths and other metals..."
"Tax credits, royalty relief on agenda for minerals crisis meeting",https://www.theaustralian.com.au/business/mining-energy/the-lithium-and-nickel-rout-has-a-way-to-run-with-all-eyes-on-pilbara-minerals-and-minres-production-reports-this-week/news-story/69ca49cd178c3019de87a36bf0c6c0a0,2024. 1. 24.,날짜 없음,Production credits and royalty relief are likely to be the top items on Thursday's crisis meeting agenda between beleaguered WA lithium and nickel producers...
