제목,링크,출처,날짜,설명
Base metals price mixed forecast on China stimulus pressure,https://www.fastmarkets.com/insights/base-metals-price-forecast-china-stimulus/,2023. 8. 2.,날짜 없음,"Despite concerns over the uncertainty of China's economic recovery, base metals price forecasts remain mixed for aluminium, copper, lead, nickel, tin and zinc..."
Could nickel reserves be the key to independence for New Caledonia?,https://www.rfi.fr/en/france/20230805-nickel-new-caledonia-independence-france,2023. 8. 5.,날짜 없음,"The South Pacific French territory of New Caledonia is a major producer of nickel, a metal that is increasingly in demand around the world to make electric..."
Dynamics of green metal price volatility in times of geopolitical tensions: Effects of oil price shocks and carbon emissions futures,https://www.sciencedirect.com/science/article/abs/pii/S095965262301541X,2023. 8. 1.,날짜 없음,"This study analyses the effect of geopolitical tensions, oil prices, and carbon emission futures on green metal prices using the SVAR model."
News Content Hub - High-manganese steel aims to lower LNG cargo and fuel tank costs,https://www.rivieramm.com/news-content-hub/news-content-hub/high-manganese-steel-aims-to-lower-lng-cargo-and-fuel-tank-costs-77185,2023. 8. 8.,날짜 없음,Hanwha Ocean R&D Institute head details the drive behind the successful development and commercialisation of high-manganese steel Type B and Type C LNG tanks.
Report: French nickel sector in danger of collapse,https://www.mining-technology.com/news/france-nickel-sector-danger-of-collapse/,2023. 8. 3.,날짜 없음,"France's nickel production is at risk of collapse and must be refinanced and restructured, according to a new government report."
Carbon Nanofiber Growth Rates on NiCu Catalysts: Quantitative Coupling of Macroscopic and Nanoscale In Situ Studies,https://pubs.acs.org/doi/10.1021/acs.jpcc.3c02657,2023. 8. 4.,날짜 없음,"Since recently, gas-cell transmission electron microscopy allows for direct, nanoscale imaging of catalysts during reaction. However, often systems are too..."
Economist Says 90% of Downstream Nickel Profits Flow to China,https://en.tempo.co/read/1757491/economist-says-90-of-downstream-nickel-profits-flow-to-china,2023. 8. 8.,날짜 없음,"Senior Economist from the University of Indonesia Faisal Basri again criticized President Joko Widodo or Jokowi's downstream mining policy, especially nickel."
Nickel Industries completes Shanghai Decent deal,https://www.miningweekly.com/article/nickel-industries-completes-shanghai-decent-deal-2023-08-04,2023. 8. 4.,날짜 없음,ASX-listed Nickel Industries has completed the acquisition of a 10% interest in the Huayue nickel/cobalt (HNC) project and an additional 10% interest in the...
"""Battery Passport"" Imminent: Opportunity or Challenge?",https://news.metal.com/newscontent/102313174/%22Battery-Passport%22-Imminent:-Opportunity-or-Challenge,2023. 8. 1.,날짜 없음,"Abstract On 10 July 2023, the European Council passed a new regulation intended to bolster the management of batteries and waste batteries (""Batteries..."
Moto Money / Nickel and Dimed: North American Motorcyclists Are Getting Ripped Off,https://www.advrider.com/nickel-and-dimed-north-american-motorcyclists-are-getting-ripped-off/,2023. 8. 8.,날짜 없음,Ever-increasing fees from the industry and government are going to leave riders ripped off and leaving two wheels.
Explained: What Tesla’s New Home In Malaysia Means For Nickel-Rich Indonesia,https://swarajyamag.com/commentary/explained-what-teslas-new-home-in-malaysia-means-for-nickel-rich-indonesia,2023. 8. 8.,날짜 없음,"Despite Tesla's snub, Indonesia has a decent success in tapping its nickel reserves to make itself indispensable for the EV industry, which uses the metal..."
The new commodity superpowers,https://www.ft.com/content/0d2fba79-940f-4a28-8f4f-68f1e755200f,2023. 8. 7.,날짜 없음,"In the first part of a series, countries that produce the metals central to the energy transition want to rewrite the rules of mineral extraction."
"Perseverance Metals Enters into Option Agreement with Altius Minerals and Bitterroot Resources to Acquire Voyageur Nickel Project in Michigan, USA",https://www.juniorminingnetwork.com/newswire/145827-perseverance-metals-enters-into-option-agreement-with-altius-minerals-and-bitterroot-resources-to-acquire-voyageur-nickel-project-in-michigan-usa.html,2023. 8. 1.,날짜 없음,"The Option Agreement gives Perseverance the exclusive option until December 31, 2025 to earn a 100% interest in the Voyageur Project from Altius Resources..."
Top 11 Battery Metals Stocks on the TSX and TSXV,https://investingnews.com/daily/resource-investing/battery-metals-investing/lithium-investing/top-battery-metals-stocks/,2023. 8. 2.,날짜 없음,What are the top battery metals stocks? Here's a look at the battery metals companies with the biggest year-to-date gains so far in 2023.
Jess Farrell at WA Mining Club,https://www.bhp.com/news/media-centre/reports-presentations/2023/08/jess-farrell-at-wa-mining-club,2023. 8. 1.,날짜 없음,Nickel West is the largest nickel producer by volume in WA and one of the world's leading suppliers of nickel to the battery market.
Battery Recycling 'Hub' Engineering Cost Study,https://www.investegate.co.uk/announcement/rns/neometals-ltd-npv-di---nmt/battery-recycling-hub-engineering-cost-study-/7667611,2023. 8. 1.,날짜 없음,Hub ECS total capital costs of €274M (including 15% contingency) and annual operating cost of €56M have been estimated to +/-25% accuracy.
"Despite reforms, mining for EV metals in Congo exacts steep cost on workers",https://www.washingtonpost.com/world/interactive/2023/ev-cobalt-mines-congo/,2023. 8. 4.,날짜 없음,"After revelations of child labor and dire conditions in Congolese cobalt mines, automakers and mineral companies said they'd adhere to international safety..."
China’s metals and mining investment overseas to hit record in 2023 – report,https://www.mining.com/chinas-metals-and-mining-investment-overseas-to-hit-record-in-2023-report/,2023. 8. 1.,날짜 없음,"Chinese investments and new contracts in the metals and mining sector topped $10 billion during the first half of 2023, a 131% growth year-on-year."
The Metals Company announces a controversial timeline for deep sea mining that worsens the divide in an already bitter battle,https://www.cnbc.com/2023/08/04/the-metals-company-puts-out-controversial-timeline-for-deep-sea-mining.html,2023. 8. 4.,날짜 없음,"The Metals Company on Tuesday stated its timeline for moving forward to collect metal nodules off the deep seafloor, a more aggressive plan than what some..."
Princess Package Changes: Why Passengers Are Angry,https://cruisepassenger.com.au/reviews/princess-package-changes-why-passengers-are-angry/,2023. 8. 3.,날짜 없음,"Princess has introduced a new 'casual' dining category, that will serve three-course, fixed-price menus, for a fee of USD$14.99."
HOT GAT or FUDD CRAP? Nickel and Gold or Tired and Old?,https://www.thefirearmblog.com/blog/2023/08/01/hot-gat-fudd-crap-nickel-gold-tired-old/,2023. 8. 1.,날짜 없음,"Welcome everyone to the 200th Edition of 'Hot Gat or Fudd Crap?', one of our many series here on TFB. If you're new to the series, this is where we look at..."
Indonesia defends its curbs on nickel ore exports,https://borneobulletin.com.bn/page/3832/?m=pc&a=page_og_list&target_c_album_image_category_id=1,2023. 8. 7.,날짜 없음,"ANN/THE JAKARTA POST – Indonesia has stepped up its defence of its nickel ore export curbs the European Union (EU) has protested against, asserting its..."
China’s Nickel Pig Iron (NPI) Production Review In July And Forecast In August,https://news.metal.com/newscontent/102329171/China%E2%80%99s-Nickel-Pig-Iron-NPI-Production-Review-In-July-And-Forecast-In-August,2023. 8. 14.,날짜 없음,"In July 2023, China's NPI output was 32800 mt in nickel content and 766000 mt in physical content, down 2.32% from June and up 5.15% YoY."
"Japan's Nickel Matte Price Drops by 9%, Averaging $15.7 per kg",https://www.indexbox.io/blog/japan-nickel-matte-price-in-april-2023/,2023. 8. 12.,날짜 없음,"Japan's Nickel Matte Price Drops by 9%, Averaging $15.7 per kg · Japan Nickel Matte Import Price in April 2023. In April 2023, the nickel matte price amounted..."
"Stainless MMI: Outokumpu Looks to Expand After Q2 Drop, Nickel Prices Find Lower High",https://agmetalminer.com/2023/08/15/stainless-mmi-nickel-prices-find-lower-high/,2023. 8. 15.,날짜 없음,"Stainless MMI: Outokumpu Looks to Expand After Q2 Drop, Nickel Prices Find Lower High ... Although nickel prices rose more than 8% during July, prices found a..."
Major nickel discoveries remain scarce amid looming supply deficits,https://www.spglobal.com/market-intelligence/en/news-insights/research/major-nickel-discoveries-remain-scarce-amid-looming-supply-deficits,2023. 8. 10.,날짜 없음,"S&P Global Commodity Insights has identified 82 major nickel discoveries made from 1990 to 2022, containing 147 million metric tons of nickel in oxide and..."
Jokowinomics headed for a third term,https://eastasiaforum.org/2023/08/14/jokowinomics-headed-for-a-third-term/,2023. 8. 14.,날짜 없음,Indonesian President Joko Widodo will leave after he departs office in October 2024 might not be the new capital city now being built in the forests of East...
Forrest nickel boss says BHP now happy,https://www.afr.com/companies/mining/forrest-nickel-boss-says-bhp-now-happy-20230809-p5dv70,2023. 8. 9.,날짜 없음,Kalgoorlie | Forrest family-owned Wyloo Metals says its recently acquired nickel mines are running at capacity and that major customer BHP has accepted all...
Rival battery technologies race to dominate electric car market,https://www.ft.com/content/67abc929-db1a-43c3-b03a-259a4316fd76,2023. 8. 13.,날짜 없음,Two forms of lithium-ion technology are vying to dominate an industry destined to be worth hundreds of billions of dollars.
Lithium Iron Phosphate Set To Be The Next Big Thing In EV Batteries,https://www.forbes.com/sites/samabuelsamid/2023/08/16/lithium-iron-phosphate-set-to-be-the-next-big-thing-in-ev-batteries/,2023. 8. 16.,날짜 없음,More companies are developing iron-based cathode lithium batteries in North America including Our Next Energy and Metri Chem that are almost matching nickel...
Benchmark: Falling lithium prices weigh on black mass prices in China,https://www.greencarcongress.com/2023/08/20230811-blackmass.html,2023. 8. 11.,날짜 없음,"Prices for black mass material—from process scrap fell by 5% in July from a month earlier, according to Benchmark's inaugural black mass price assessment..."
Nickel Asia sees higher ore exports,https://www.philstar.com/business/2023/08/10/2287441/nickel-asia-sees-higher-ore-exports,2023. 8. 10.,날짜 없음,"Nickel Asia Corp. (NAC) is looking to outperform in terms of nickel ore exports this year amid warmer temperature, especially with the looming El Niño..."
"Tsingshan starts 50,000t nickel plant in Indonesia",https://www.mining.com/web/tsingshan-starts-50000t-nickel-plant-in-indonesia/,2023. 8. 21.,날짜 없음,"Major Chinese nickel maker Tsingshan Group has started commercial production of refined nickel in Indonesia, three sources familiar with the production told..."
BNC’s quarterly nickel output jumps 8pc,https://www.herald.co.zw/bncs-quarterly-nickel-output-jumps-8pc/,2023. 8. 18.,날짜 없음,"LISTED Bindura Nickel Corporation (BNC) recorded an 8 percent increase in nickel ore production to 11 7249 tonnes in the first quarter to June 30,..."
"Asia Pacific EV Market Size, Growth Statistics Report 2032",https://www.gminsights.com/industry-analysis/asia-pacific-electric-vehicle-market,2023. 8. 17.,날짜 없음,"Asia Pacific Electric Vehicle (EV) Market Size - By Vehicle (Two-wheelers, Passenger Cars, Commercial), By Battery (Sealed Lead Acid, Nickel Metal Hydride,..."
Barry FitzGerald: Tolga Kumova throws the right stuff at Aston Minerals’ Boomerang nickel project,https://stockhead.com.au/experts/barry-fitzgerald-tolga-kumova-throws-the-right-stuff-at-aston-minerals-boomerang-nickel-project/,2023. 8. 19.,날짜 없음,"The recent spate of capital cost blowouts and asset impairments in the ASX mining space has once again highlighted that experience in building things,..."
Indonesian Owned Nickel Company,https://en.tempo.co/read/1762832/indonesian-owned-nickel-company,2023. 8. 22.,날짜 없음,"PT Ceria Nugraha Indotama (CERIA), is a nickel mining company owned by Indonesia. The company carries out its mining activities from upstream which is..."
Price fluctuations of battery raw materials: How the automotive industry reacts and their impact on cell costs,https://www.isi.fraunhofer.de/en/blog/themen/batterie-update/batterie-rohstoffe-preis-schwankungen-wie-reagiert-automobil-industrie-auswirkungen-zellkosten.html,2023. 8. 24.,날짜 없음,Battery raw material prices fluctuate enormously. How automotive manufacturers are changing their strategies for supply contracts and what role raw material...
Bring Commodities Market Regulators into the Critical Minerals Discussion,https://www.csis.org/analysis/bring-commodities-market-regulators-critical-minerals-discussion,2023. 8. 23.,날짜 없음,"What can be done to make mineral markets less volatile, more transparent, and ready for more private capital? Commodities regulators hold a key to solving..."
Indonesia Holds Great Promise for Rapid Economic Growth,https://internationalbanker.com/finance/indonesia-holds-great-promise-for-rapid-economic-growth/,2023. 8. 21.,날짜 없음,"Indonesia, Southeast Asia's largest economy, is resolved to break out of the “always developing” middle-income trap and become a high-income,..."
"Black Mass, Black Gold, and The Truth About EV Battery Recycling",https://cleantechnica.com/2023/08/21/black-mass-black-gold-and-the-truth-about-ev-battery-recycling/,2023. 8. 21.,날짜 없음,The “black mass” that we're referring to is the residual compound formed by “shredding” li-ion batteries that have reached the end of their usable life cycle.
Nickel and gold woes hit Benguet Corp as profits halve in first half,https://bilyonaryo.com/2023/08/22/nickel-and-gold-woes-hit-benguet-corp-as-profits-halve-in-first-half/business/,2023. 8. 22.,날짜 없음,Romualdez-led Benguet Corp. saw earnings plummet by more than half in the first six months of the year as lower nickel ore prices and reduced gold...
Metals in meltdown: investors should buy now,https://moneyweek.com/investments/metals-in-meltdown-investors-should-buy-now,2023. 8. 17.,날짜 없음,"Aluminium, zinc and nickel have struggled over the past few months, says David J. Stevenson. But the best time to scoop up shares in the companies that mine..."
BHPs economic and commodity outlook,https://www.bhp.com/investors/economic-and-commodity-outlook/2023/08/bhps-economic-and-commodity-outlook,2023. 8. 22.,날짜 없음,"We expected that price formation would, on average, improve across calendar 2023 versus the second half of calendar 2022."
‘The Nickel’ returns to Fairmont State University,https://www.wdtv.com/2023/08/19/nickel-returns-fairmont-state-university/,2023. 8. 18.,날짜 없음,"In 1947, FSU students..."
Significant Drop in Germany's Lithium Carbonate Price to $13.7/kg - News and Statistics,https://www.indexbox.io/blog/germany-lithium-carbonate-price-in-may-2023/,2023. 8. 20.,날짜 없음,"In May 2023, the price of Lithium Carbonate was $13739 per ton (CIF, Germany), experiencing a decrease of -30.6% compared to the previous month."
"NYS Fair Food Hall of Fame #3: Milk, nostalgia in a 7-ounce cup for 2 dimes and a nickel",https://www.syracuse.com/statefair/2023/08/nys-fair-food-hall-of-fame-3-milk-nostalgia-in-a-7-ounce-cup-for-2-dimes-and-a-nickel.html,2023. 8. 18.,날짜 없음,"A 7-ounce cup of white or chocolate moo juice will set you back two dimes and a nickel, just as it has since 1983."
FIFO influx with major projects to add pressure on Kalgoorlie-Boulder accommodation shortage,https://www.abc.net.au/news/2023-08-19/major-projects-add-pressure-on-kalgoorlie-accommodation-shortage/102746348,2023. 8. 18.,날짜 없음,"Major construction projects in the region have mining companies scrambling to find accommodation to house the influx of FIFO workers, with at least 600 beds..."
BHP ASX: BHP says onshore smelting at heart of green metals pivot,https://www.afr.com/companies/mining/bhp-says-onshore-smelting-at-heart-of-green-metals-pivot-20230822-p5dyir,2023. 8. 22.,날짜 없음,"BHP boss Mike Henry says Australia will need to be “hyper-productive” to compete in future-facing metals such as copper and nickel, as he invests more in..."
Battery recycling firm RecycleKaro to invest Rs 100 crore to set up Nickel plant in Maharashtra,https://m.economictimes.com/industry/renewables/battery-recycling-firm-recyclekaro-to-invest-rs-100-crore-to-set-up-nickel-plant-in-maharashtra/articleshow/103010857.cms,2023. 8. 24.,날짜 없음,Lithium-ion battery recycling firm RecycleKaro on Thursday said it plans to invest Rs 100 crore for setting up a nickel plant in Maharashtra with a capacity...
Jeff Garrett: Buying the 1913 Liberty Nickel,https://coinweek.com/jeff-garrett-buying-the-1913-liberty-nickel/,2023. 8. 23.,날짜 없음,Coin dealer and numismatist Jeff Garrett reminisces on the 10th anniversary of his purchase of the Walton 1913 Liberty nickel.
Resources Top 5: Australian Silica Quartz hunts 10Mt motherlode; Aldoro delves in thick for nickel,https://stockhead.com.au/resources/top-resources-5-australian-silica-quartz-hunts-10mt-resource-aldoro-delves-in-thick-for-nickel/,2023. 8. 17.,날짜 없음,"Australian Silica Quartz is hunting a big payload in North Queensland, while Aldoro Resources is digging up thick, high-grade NSW nickel."
Magna Mining planning to reopen Sudbury's Crean Hill mine,https://www.cbc.ca/news/canada/sudbury/magna-mining-sudbury-crean-hill-mine-mineral-exploration-1.6929892,2023. 8. 18.,날짜 없음,"Magna Mining is planning to revive the Crean Hill Mine, an underground mine in Greater Sudbury that produced nickel, copper and other resources for more..."
Nickel export strategy: Philippines eyes processing plants for economic edge,https://bilyonaryo.com/2023/08/24/nickel-export-strategy-philippines-eyes-processing-plants-for-economic-edge/business/,2023. 8. 24.,날짜 없음,"The Philippines won't stop exporting nickel ore to China and other countries. Instead, the Department of Trade and Industry is looking at ways to get miners to..."
PHL’s RE-friendly minerals expected to be heavily mined,https://www.bworldonline.com/economy/2023/08/22/541086/phls-re-friendly-minerals-expected-to-be-heavily-mined/,2023. 8. 22.,날짜 없음,"MINERALS produced by the Philippines will be in heavy demand during the transition to renewable energy (RE), pointing to the need for enhanced government..."
Bengaluru-based Nsure to foray into lithium-ion cell manufacturing; 1GWh plant set to come up in Karnataka,https://etn.news/energy-storage/bengaluru-based-nsure-to-foray-into-lithium-ion-cell-manufacturing-1gwh-plant-set-to-come-up-in-karnataka,2023. 8. 24.,날짜 없음,Bengaluru-based NSure Reliable Power Solutions (Nsure) to foray into lithium-ion cell manufacturing in India with initial production capacity of 1 GWh.
Australian Mining — Can It Power All The New EVs?,https://cleantechnica.com/2023/08/20/australian-mining-can-it-power-all-the-new-evs/,2023. 8. 20.,날짜 없음,The Australian mining industry represents approximately 14% of GDP (gross domestic product). It makes up more than two-thirds of Australia's exports.
Nickel CBS August 2023 – Prices drop; China's refined nickel capacity expands,https://www.spglobal.com/market-intelligence/en/news-insights/research/nickel-cbs-august-2023-prices-drop-china-s-refined-nickel-capacity-expands,2023. 8. 31.,날짜 없음,Nickel CBS August 2023 – Prices drop; China's refined nickel capacity expands ... S&P Global Market Intelligence's Pipeline Activity Index (PAI) collapsed in June...
Hyundai Motor Group Partners with Korea Zinc on Value Chain for EV Business,https://www.hyundai.news/eu/articles/press-releases/hyundai-partners-with-korea-zinc-on-value-chain-for-ev-business.html,2023. 8. 30.,날짜 없음,"The Group will cooperate with Korea Zinc, Korea's leading non-ferrous metal smelting company, in a comprehensive collaboration across the nickel value chain."
"Hyundai Motor Group, Korea Zinc Look to Expand EV Battery Materials","https://www.environmentenergyleader.com/stories/hyundai-motor-group-korea-zinc-look-to-expand-ev-battery-materials,4591",2023. 8. 31.,날짜 없음,Hyundai Motor Group has signed an agreement with Korea Zinc for joint outsourcing of nickel raw material and collaboration across the nickel value chain.
Indonesia nickel mining quota delays due to switch back to old system – official,https://www.mining.com/web/indonesia-nickel-mining-quota-delays-due-to-switch-back-to-old-system-official/,2023. 8. 28.,날짜 없음,Prices of nickel ore in Indonesia have surged about 10% in recent weeks.
The top ten critical minerals powerhouses of the energy transition,https://www.energymonitor.ai/sectors/extractive-industries/the-top-ten-critical-minerals-powerhouses-of-the-energy-transition/,2023. 8. 30.,날짜 없음,"Four minerals – lithium, cobalt, copper and nickel – will underpin the energy transition, but which countries are sitting on the largest reserves?"
Critical Minerals Market Review 2023,https://evboosters.com/ev-charging-news/critical-minerals-market-review-2023/,2023. 8. 30.,날짜 없음,This report analyses the critical minerals market's impact on clean energy technologies and the need for secure and sustainable supplies.
Platts releases US black mass price assessments,https://www.recyclingtoday.com/news/platts-releases-us-black-mass-price-assessments/,2023. 8. 30.,날짜 없음,"Platts, part of S&P Global Commodity Insights, has launched four US spot physical black mass price assessments. Valued on a delivered-duty-paid (DDP) basis."
Indonesian nickel smelters turn to Philippines for ore as local supply tightens,https://www.reuters.com/markets/commodities/indonesian-nickel-smelters-turn-philippines-ore-local-supply-tightens-2023-08-30/,2023. 8. 30.,날짜 없음,"Nickel smelters in top producer Indonesia are making rare purchases of ore from the Philippines to ease tight supplies, people familiar with the matter said..."
LMFP battery will revolutionise affordability for EVs,https://www.crugroup.com/en/communities/thought-leadership/2023/lmfp-battery-material-will-revolutionise-energy-density-and-affordability-for-electric-vehicles/,2023. 8. 29.,날짜 없음,LMFP batteries will improve on the long-bemoaned energy density disadvantage of lithium iron phosphate (LFP) while maintaining a low-cost structure.
Nkomati Nickel mine revisited,https://www.africanmining.co.za/2023/09/01/nkomati-nickel-mine-revisited/,2023. 9. 1.,날짜 없음,Nkomati mine was South Africa's only primary nickel mine and has now been placed on care and maintenance. Dr Nicolaas C Steenkamp took a drive past to see how...
Why the electric-vehicle industry is talking about ‘black mass’,https://www.japantimes.co.jp/business/2023/08/29/tech/hyperdrive-ev-industry-black-mass/,2023. 8. 29.,날짜 없음,"""Black mass"" is just a very literal description of the intermediate product from recycling either spent electric-vehicle batteries or scrap from battery plants."
Nickel Creek Platinum shares drop as prefeasibility puts Shaw project capex at $1.7B,https://northernminer.com/news/nickel-creek-platinum-shares-drop-as-prefeasibility-puts-shaw-project-capex-at-1-7b/1003858062/,2023. 8. 25.,날짜 없음,Nickel Creek Platinum (TSX: NCP; US-OTC: NCPCF) shares fell by 16.7% to 2.5¢ each on Friday after the company released a prefeasibility study giving its...
Nickel industry pushes for streamlining of permitting process,https://www.pna.gov.ph/articles/1208730,2023. 8. 29.,날짜 없음,MANILA – The Philippines has the capacity to supply over 40 million tons of nickel ore to the global market but changes must be made in the permitting...
Lifezone reports strong results at Kabanga nickel project ahead of feasibility,https://www.mining.com/lifezone-reports-strong-results-at-kabanga-nickel-project-ahead-of-feasibility/,2023. 8. 31.,날짜 없음,"Lifezone Metals (NYSE: LZM), which is 17% held by mega-miner BHP (NYSE: BHP; LSE: BHP; ASX: BHP), has reported high-grade results from its completed infill..."
Nickel miners expect output to be little changed in 2023,https://www.bworldonline.com/economy/2023/08/29/542190/nickel-miners-expect-output-to-be-little-changed-in-2023/,2023. 8. 29.,날짜 없음,"THE Philippine Nickel Industry Association (PNIA) said nickel production is expected to be flat this year, with miners hoping to make up for a weak first..."
"Kalgoorlie-Boulder council agrees to lease land to BHP for 1,100-bed mining camp in deal worth $1.3m a year",https://www.abc.net.au/news/2023-08-29/bhp-1100-bed-mining-camp-in-kalgoorlie-gets-council-approval/102788096,2023. 8. 29.,날짜 없음,"The three-year lease agreement, which includes three one-year options, is expected to generate more than $1.3 million a year in rent and rates for the council."
Canada's critical mineral advantage and its emerging role as a key player in the EV supply chain,https://www.lexology.com/library/detail.aspx?g=278780b8-048d-49cc-9e1e-6f84d8477545,2023. 8. 31.,날짜 없음,"Canada is a major producer of primary aluminum, cobalt, diamonds, molybdenum, nickel, platinum group metals, salt, titanium concentrate, tungsten, uranium, and..."
