제목,링크,출처,날짜,설명
The role of nickel in EV battery manufacturing,https://www.innovationnewsnetwork.com/the-role-of-nickel-in-ev-battery-manufacturing/38877/,2023. 10. 27.,날짜 없음,Nickel stands out due to its unique properties. Its energy density and capacity retention make it essential in EV battery manufacturing.
Indonesia’s commodity future in the face of China’s slowdown,https://eastasiaforum.org/2023/10/20/indonesias-commodity-future-in-the-face-of-chinas-slowdown/,2023. 10. 20.,날짜 없음,"As China's appetite for raw materials weakens, Indonesia must look for new ways to add value to its nickel reserves, writes Nabiel Arzyan (CReco..."
"Grids or gridlock, plus other top energy stories this week",https://www.weforum.org/stories/2023/10/grids-electricity-green-energy-news-23-october/,2023. 10. 20.,날짜 없음,Top energy news: Deadlock broken on new EU power market rules; Urgent upgrades needed to global electricity grids; Successful test of first 100% hydrogen...
"Increasing Transparency in Critical Materials Price, Supply, and Demand Forecasts",https://www.darpa.mil/news/2023/transparency-critical-materials-forecast,2023. 10. 25.,날짜 없음,"DARPA OPEN program seeks technology solutions to enhance supply chain resilience, national security by increasing global critical materials market transparency."
Nornickel starts sulphur dioxide capture in Russia's most polluted city,https://www.reuters.com/markets/commodities/nornickel-starts-sulphur-dioxide-capture-russias-most-polluted-city-2023-10-25/,2023. 10. 25.,날짜 없음,"Russian mining giant Nornickel launched a multi-billion dollar project on Wednesday aimed at reducing sulphur dioxide emissions by 45% in Norilsk,..."
Firms are exploring sodium batteries as an alternative to lithium,https://www.economist.com/science-and-technology/2023/10/25/firms-are-exploring-sodium-batteries-as-an-alternative-to-lithium,2023. 10. 25.,날짜 없음,"Unlike lithium, sodium is cheap and abundant | Science & technology."
Harold to take on top job at Rumble Resources after board restructure at Poseidon Nickel,https://www.kalminer.com.au/news/regional/harold-to-take-on-top-job-at-rumble-resources-after-board-restructure-at-poseidon-nickel-c-12318262,2023. 10. 25.,날짜 없음,"The former managing director of Poseidon Nickel, Peter Harold, will assume the top job at zinc, lead and silver explorer Rumble Resources from February next..."
"Battery metal prices collapse on supply glut, cool Chinese EV demand",https://www.afr.com/companies/mining/battery-metal-prices-collapse-on-supply-glut-cool-chinese-ev-demand-20231018-p5ed8u,2023. 10. 20.,날짜 없음,Prices for key battery metals required for the clean energy transition – such as lithium and nickel – have collapsed since the start of the year amid a...
A Cabernet Legacy Built to Last,https://daily.sevenfifty.com/a-cabernet-legacy-built-to-last/,2023. 10. 24.,날짜 없음,"Over four decades, Far Niente Wine Estates has built a portfolio of emblematic Napa Valley Cabernet Sauvignons at every price point…"
"Nickel, processing needs in Albania",https://monitor.al/en/nickel-processing-needs-in-Albania-2/,2023. 10. 20.,날짜 없음,The total geological resources (A+B+C1+C2) of nickel ore deposits in Albania are estimated to be about 310 million tons of Fe-Ni and Ni-Si ore.
Asia’s multiple economic headwinds,https://flow.db.com/more/macro-and-markets/asias-multiple-economic-headwinds,2023. 10. 27.,날짜 없음,Deutsche Bank Research analysts look at the multiple headwinds impacting the outlook for Asian markets – and provide hedging guidance for corporates with local...
Leveraging lithium and nickel stocks to boost the EV industry,https://eastasiaforum.org/2023/10/26/leveraging-lithium-and-nickel-stocks-to-boost-the-ev-industry/,2023. 10. 26.,날짜 없음,"Australia and Indonesia should not limit their cooperation to a bilateral endeavour alone, as EV batteries need much more than just nickel and lithium."
How junior explorers can emerge from the dust,https://www.mining.com/how-junior-explorers-can-emerge-from-the-dust/,2023. 10. 20.,날짜 없음,2023 has been a difficult year for the junior mining sector. Across the board we've seen small-cap explorers sell-down toward multi-year lows.
"Your nickel could be worth $281,750 if it has a double die detail on the obverse",https://www.the-sun.com/money/9377215/buffalo-nickel-double-die-details/,2023. 10. 20.,날짜 없음,YOU may want to check your change as a nickel has sold for over $281000.Most nickels you'll find nowadays feature the image of the US's third pre.
Jurisdiction spotlight: Who’s poised to ride the infrastructure coattails of BHP’s $1.7bn Nebo-Babel mine ...,https://stockhead.com.au/resources/jurisdiction-spotlight-whos-poised-to-ride-the-infrastructure-coattails-of-bhps-1-7bn-nebo-babel-mine-development/,2023. 10. 20.,날짜 없음,"The remote West Musgrave region is emerging as a new mining hub near the intersection of the borders between WA, SA and the NT."
Things Are Looking Up for Asteroid Mining,https://www.wired.com/story/things-are-looking-up-for-asteroid-mining/,2023. 10. 20.,날짜 없음,"Asteroids are rich with the metals used in clean energy technologies. As demand soars, advocates argue that mining them in space might be better than mining..."
Ten Extreme U.S. Error Coins Bring Big Prices,https://coinweek.com/ten-extreme-u-s-error-coins-bring-big-prices/,2023. 10. 23.,날짜 없음,Extreme error coins are highly sought after by coin collectors. These ten U.S. mint errors have brought high prices at recent auctions.
Cobalt-free lithium-ion batteries outperform their peers,https://cosmosmagazine.com/technology/energy/cobalt-free-lithium-batteries/,2023. 10. 21.,날짜 없음,Researchers have shown it's possible to make efficient lithium-ion batteries without cobalt - and still compete with commercial batteries.
15 Valuable Coins Hiding in Your Pocket,https://wallethacks.com/valuable-coins-hiding-in-your-pocket/,2023. 10. 23.,날짜 없음,Quarters minted between 1932 and 1964 are 90% silver. They're worth more than a typical quarter because of all that precious metal.
Nickel prices drop to two-year low on oversupply,https://www.mysteel.net/news/5044351-nickel-prices-drop-to-two-year-low-on-oversupply,2023. 11. 1.,날짜 없음,"Nickel prices drop to two-year low on oversupply ... The most-traded SHFE nickel contract registered a new low since December 2021 at Yuan 140,200/tonne on..."
Bears bet big that nickel can close the product gap,https://www.reuters.com/markets/commodities/bears-bet-big-that-nickel-can-close-product-gap-2023-11-01/,2023. 11. 2.,날짜 없음,The bears are out in force on the London Metal Exchange (LME) nickel market.
Lithium price drop and nickel output reduction hit IGO's Q1 earnings,https://www.investing.com/news/stock-market-news/lithium-price-drop-and-nickel-output-reduction-hit-igos-q1-earnings-93CH-3212828,2023. 10. 29.,날짜 없음,Lithium price drop and nickel output reduction hit IGO's Q1 earnings ... © Reuters. ... Australian mining company IGO reported a significant 42% drop in its...
Glencore cuts 2023 nickel guidance as strikes hit production,https://www.mining.com/glencore-cuts-2023-nickel-production-guidance-as-strikes-hit-production/,2023. 10. 30.,날짜 없음,The company has lowered its guidance for full-year nickel production by 9% to approximately 102000 metric tons.
Electric vehicle battery prices are falling faster than expected,https://www.goldmansachs.com/insights/articles/electric-vehicle-battery-prices-falling,2023. 11. 1.,날짜 없음,Goldman Sachs Research now expects battery prices to fall to $99 per kilowatt hour (kWh) of storage capacity by 2025 — a 40% decrease from 2022...
Sibanye-Stillwater continuing to assess operational positioning,https://www.miningweekly.com/article/sibanye-stillwater-continuing-to-assess-operational-positioning-2023-11-02,2023. 11. 2.,날짜 없음,"With the global macroeconomic environment remaining challenging, Sibanye-Stillwater is continuing to assess the positioning of its operations for optimal..."
Nickel odium: critics pan BoE role in LME meltdown,https://www.risk.net/regulation/7958120/nickel-odium-critics-pan-boe-role-in-lme-meltdown,2023. 10. 31.,날짜 없음,The surge in nickel prices that led to the cancellation of nickel trades worth billions of dollars on the London Metal Exchange last March has raised questions...
U.S. senators oppose Indonesia FTA that paves way for nickel subsidies,https://asia.nikkei.com/Spotlight/Supply-Chain/U.S.-senators-oppose-Indonesia-FTA-that-paves-way-for-nickel-subsidies,2023. 11. 2.,날짜 없음,"US lawmakers have expressed concern about signing a limited free trade agreement with Indonesia, seeking to block the Southeast Asian nation's critical..."
Chinese companies are investing billions in Indonesia's nickel industry — but working conditions can be deadly,https://www.abc.net.au/news/2023-11-05/chinese-companies-invest-billions-in-indonesias-nickel-industry/103013262,2023. 11. 4.,날짜 없음,"Chinese companies invest billions in Belt and Road nickel refining projects in Indonesia, but for people working on the frontline, conditions can be deadly."
Indonesia’s EV Transformation: A Work in Progress,https://fulcrum.sg/indonesias-ev-transformation-a-work-in-progress/,2023. 10. 31.,날짜 없음,The Indonesian government is seeking to ramp up the adoption of electric vehicles on the country's road. But several challenges remain.
"Nickel Industries posts record quarterly earnings, production",https://mining.com.au/nickel-industries-posts-record-quarterly-earnings-production/,2023. 10. 31.,날짜 없음,Nickel producer Nickel Industries (ASX:NIC) has posted record quarterly earnings from its Indonesian operations as production rises and costs fall.
Scenarios for Israel’s defense industry,https://www.gisreportsonline.com/r/israel-defense-industry/,2023. 10. 31.,날짜 없음,"The previously thriving Israeli defense sector is now grappling with geopolitical tensions, supply shortages and changing demographics."
Lundin Mining Third Quarter 2023 Results,http://lundinmining.com/news/lundin-mining-third-quarter-2023-results-123134/,2023. 11. 1.,날짜 없음,"Our operations continued with a strong performance in the third quarter. As a result, we are increasing our production guidance for Caserones and Eagle."
Antofagasta’s Twin Metals appeals dismissed lawsuit over Minnesota copper-nickel project,https://www.mining.com/antofagastas-twin-metals-appeals-dismissed-lawsuit-over-minnesota-copper-nickel-project/,2023. 11. 3.,날짜 없음,"Company said it has spent more than 13 years in northeast Minnesota conducting extensive environmental, engineering, exploration, hydrogeological and..."
A beginner’s guide to battery metals (and 14 ways to invest),https://www.marketindex.com.au/news/a-beginners-guide-to-battery-metals-and-14-ways-to-invest,2023. 11. 2.,날짜 없음,"Geopolitics and energy shortages underpin the investment thesis for the likes of lithium, nickel, rare earths and copper."
Sibanye-Stillwater weighs new round of restructuring at Stillwater,https://www.miningmx.com/news/gold/54879-sibanye-stillwater-weighs-new-round-of-restructuring-at-stillwater-mine/,2023. 11. 2.,날짜 없음,SIBANYE-Stillwater turned in mixed results for the third quarter in which its Australian tailings retreatment business New Century Resources posted a...
BHP’s Jess Farrell a torchbearer for WA’s mining diversity,https://thewest.com.au/business/insider/insider-magazine-nickel-west-chief-jess-farrell-a-torchbearer-for-wa-mining-industrys-growing-diversity--c-12030836,2023. 10. 31.,날짜 없음,"INSIDER: Supported by strong female role models, Nickel West boss Jess Farrell is now paying it forward as a champion for diversity in the resources sector."
Rare U.S. Currency in Stack’s Bowers November 2023 Showcase Auction,https://coinweek.com/rare-u-s-currency-in-stacks-bowers-november-2023-auction/,2023. 10. 30.,날짜 없음,"High-end rare U.S. Currency is the focus of the Stack's Bowers Galleries November 17, 2023 Showcase Auction."
"Russia's Nornickel board recommends dividend, approves stock split",https://www.reuters.com/markets/commodities/russias-nornickel-board-recommends-dividend-approves-stock-split-2023-11-03/,2023. 11. 3.,날짜 없음,Russian mining giant Norilsk Nickel on Friday said its board had recommended a nine-month dividend of 915.33 roubles ($9.87) per share and approved a stock...
Alaska Energy Metals stock rises on drill results at Nikolai nickel project,https://www.mining.com/alaska-energy-metals-stock-rises-on-drill-results-at-nikolai-nickel-project/,2023. 10. 30.,날짜 없음,Alaska Energy Metals' (TSXV: AEMC) stock rose on Monday after releasing results for two additional diamond drill holes from its 2023 exploration program.
Farrell a champion for diversity in resources sector,https://thewest.com.au/business/insider-magazine-bhps-nickel-west-chief-jess-farrell-hitting-paydirt-on-job-equality--c-12378404,2023. 10. 31.,날짜 없음,"Jess Farrell is a great believer in rolling up her sleeves and getting the job done. In August 2021, Ms Farrell was appointed the first female head of BHP's..."
Your nickel may be worth $4.5 million if it has exact 'proof' detail,https://www.the-sun.com/money/9466227/nickel-liberty-head-rare-valuable-coin/,2023. 10. 31.,날짜 없음,A HUMBLE nickel could make you a millionaire if you know the details to look for. A 1913 coin has broken auction records by selling for $4560000.
Chevrolet Bolt gets lower-cost LFP batteries for next gen,https://www.autoblog.com/features/chevrolet-bolt-gets-lower-cost-lfp-batteries-for-next-generation,2023. 10. 31.,날짜 없음,"The plan to use lithium-iron phosphate (LFP) batteries, which are markedly less expensive than the lithium-ion pack in the current car."
"Your quarter could be worth $10,181 but you need the exact year and ‘smaller’ detail...",https://www.the-sun.com/money/9483060/rare-quarter-coins-nickel/,2023. 11. 1.,날짜 없음,IT may be time to bust out those coins as a rare quarter sold online for $10181.Rare coins are a dime a dozen but ones that have real monetary value.
"Graphic: Surpluses on the horizon, but output cuts to help buoy nickel price",https://www.mining.com/web/graphic-surpluses-on-the-horizon-but-output-cuts-to-help-buoy-nickel-price/,2023. 11. 10.,날짜 없음,"Specifically, the cutbacks have affected nickel pig iron (NPI) and ferronickel, both used to make stainless steel, where prices at around $14,000 a metric ton..."
"Nickel 28 Capital’s Ramu mine produces 8,979 tonnes nickel in Q3 2023",https://resourceworld.com/nickel-28-capitals-ramu-mine-produces-8979-tonnes-nickel-in-q3-2023/,2023. 11. 10.,날짜 없음,"Nickel 28 Capital Corp. [TSXV-NKL; FSE-3JC0] provided operational results for the production quarter ending September 30, 2023, for the company's largest..."
Aerospace sector’s appetite for steel threatens metal supply,https://www.rystadenergy.com/news/aerospace-sector-appetite-for-steel-threatens-metal-supply,2023. 11. 7.,날짜 없음,"A vigorous recovery from the global aerospace industry has increased demand for nickel, a key aircraft component prized for its corrosion resistance."
Crackdown on illegal mining forces Indonesia to import nickel ore,https://www.ft.com/content/557478a8-0ec5-4495-9102-fb8781ba7451,2023. 11. 5.,날짜 없음,"An anti-graft crackdown has delayed the issuance of Indonesian nickel mining quotas, forcing smelters to seek other suppliers."
4 factors shaping the battery metals market,https://www.spglobal.com/commodity-insights/en/news-research/blog/metals/111023-4-factors-shaping-the-battery-metals-market-lithium-cobalt-nickel-black-mass,2023. 11. 10.,날짜 없음,"Amid persistent macroeconomic uncertainty, spot demand for battery metals has waned over 2023, contributing to a general weakening of metals prices."
Cloud service firms lock customers in while nickel-and-diming them,https://www.theguardian.com/business/2023/nov/05/cloud-service-provider-consumer-prices-netflix-microsoft,2023. 11. 6.,날짜 없음,"It's a company's dream business model – the services are too difficult to switch, and small price increases are often overlooked."
How and where nickel-hydrogen batteries beat lithium-ion in total cost of ownership,https://solarbuildermag.com/news/how-and-where-nickel-hydrogen-batteries-beat-lithium-ion-in-total-cost-of-ownership/,2023. 11. 8.,날짜 없음,Nickel-hydrogen is the most cost effective across the 1-12 hour range when operating at two cycles per day with an LCOS between $115-150/MWh due to its long...
NY’s Office of Cannabis Management just changed nickel limits for farmers. What does that mean?,https://www.syracuse.com/marijuana/2023/11/nys-office-of-cannabis-management-just-changed-nickel-limits-for-farmers-what-does-that-mean.html,2023. 11. 9.,날짜 없음,"An in-depth Q&A with AUCC Aaron Leentjes dives into the touchy subject of nickel limits, and whether OCM's recent change should have come about earlier."
Many Buffalo nickels worth more than five cents,https://www.fourstateshomepage.com/news/missouri/many-buffalo-nickels-worth-more-than-five-cents/,2023. 11. 9.,날짜 없음,"MINDENMINES, Mo. — Throughout the history of the United States Mint, many different designs have made their way onto American coins, but few of them are..."
Pantoro divests Norseman rights to MinRes for $60 million,https://mining.com.au/pantoro-divests-norseman-rights-to-minres-for-60-million/,2023. 11. 10.,날짜 없음,"Pantoro (ASX:PNR) has executed a binding agreement with Mineral Resources (ASX:MIN) by which Pantoro will divest its lithium, nickel, copper,..."
How Canada – and Bay Street – squandered the chance to finance the critical minerals revolution,https://www.theglobeandmail.com/business/article-critical-minerals-mining-companies-canadian-investors-capital/,2023. 11. 10.,날짜 없음,"Capital has disappeared from Canada's once-thriving junior mining industry. Badly-burned investors are scared to touch the sector, and companies are barely..."
LG Energy may produce mid-nickel EV batteries from 2024,https://www.kedglobal.com/batteries/newsView/ked202311200018,2023. 11. 20.,날짜 없음,"South Korea's LG Energy Solution Ltd. plans to mass-produce mid-nickel, high-voltage lithium batteries as early as next year, one year ahead of schedule."
SK ecoplant Files Patents for 4 Key Technologies in Waste Battery Recycling,https://www.businesskorea.co.kr/news/articleView.html?idxno=205762,2023. 11. 15.,날짜 없음,"SK ecoplant has successfully internalized four critical technologies encompassing the pre- and post-processing stages of waste battery recycling,..."
Rethinking Indonesia’s nickel policies to power economic growth,https://eastasiaforum.org/2023/11/20/rethinking-indonesias-nickel-policies-to-power-economic-growth/,2023. 11. 20.,날짜 없음,Indonesia's priority should be cultivating free trade agreements for nickel with the United States and the European Union.
Aerospace Industry’s Recovery Is Increasing Demand for Nickel,https://www.instituteforenergyresearch.org/fossil-fuels/aerospace-industrys-recovery-is-increasing-demand-for-nickel/,2023. 11. 16.,날짜 없음,"The global aerospace industry's recovery has increased demand for nickel, a key aircraft component due to its corrosion resistance, high strength and..."
"Vale Canada, Sumitomo Metal sign initial agreement to sell 14% stake in Indonesia nickel miner",https://www.reuters.com/markets/deals/vale-canada-sumitomo-metal-sign-initial-deal-sell-14-stake-indonesian-nickel-2023-11-17/,2023. 11. 17.,날짜 없음,Vale Base Metals said its Vale Canada unit and Japan's Sumitomo Metal Mining signed an initial agreement on Friday to sell a 14% stake in their Indonesian...
ASX-listed nickel players eye an opportunity as demand for EV batteries rise,https://www.proactiveinvestors.co.uk/companies/news/1033136/asx-listed-nickel-players-eye-an-opportunity-as-demand-for-ev-batteries-rise-1033136.html,2023. 11. 15.,날짜 없음,The major advantage of using nickel in batteries is that it helps deliver higher energy density and greater storage capacity at a lower cost.
Indonesia and US talks focus on critical minerals agreement including nickel,https://www.bestmag.co.uk/indonesia-and-us-talks-focus-on-critical-minerals-agreement-including-nickel/,2023. 11. 16.,날짜 없음,President Joko Widodo of Indonesia met with US President Joe Biden in Washington for talks on Monday on a comprehensive strategic partnership.
Mineral Resources boosts stake in lithium miner Azure Minerals,https://www.mining.com/mineral-resources-boosts-in-lithium-miner-azure-minerals/,2023. 11. 14.,날짜 없음,Both MinRes and Hancock Prospecting have upped their stakes in Azure to block a takeover of the Aussie junior by Chile's SQM.
Salt batteries gaining market share,https://www.superyachtnews.com/technology/salt-batteries-gaining-market-share,2023. 11. 14.,날짜 없음,Salt batteries gaining market share. Dario Schiavo explores the role the salt battery may play in a more sustainable future.
"Some buffalo nickels could be worth thousands of dollars under these conditions, collector says",https://www.usatoday.com/story/money/2023/11/16/buffalo-nickels-value-determination/71601321007/,2023. 11. 16.,날짜 없음,If you have a nickel with a buffalo on it you may have more than five cents. Many buffalo nickels can be traded for about 50 cents but under the right...
Top 10 Battery Metals & Renewable Energy Mining Stocks,https://www.securities.io/top-10-battery-metals-renewable-energy-mining-stocks/,2023. 11. 18.,날짜 없음,Alongside a concerted effort to push the adoption of EVs has come increased demand for the metals needed to manufacture batteries.
Rare Earth Minerals Are More in Demand than Ever—Here Are the Ones to Know,https://www.investopedia.com/critical-earth-minerals-7568912,2023. 11. 14.,날짜 없음,"Critical minerals such as cobalt, lithium, nickel, and rare earth elements are essential in making everything from smartphones and laptops to electric cars."
12 Biggest ASX Battery Metals Stocks in 2023,https://investingnews.com/top-battery-metals-stock-asx/,2023. 11. 16.,날짜 없음,"Lithium, graphite, cobalt and nickel have all caught the eye of investors. Here is a list of the best battery metal stocks on the ASX so far this year by..."
Bottle deposit will double to 10 cents on Jan. 1,https://www.nbcconnecticut.com/news/local/bottle-deposit-will-double-to-10-cents-on-jan-1/3148877/,2023. 11. 14.,날짜 없음,"There are new changes on the way for bottle and can deposits in Connecticut. “I think overall it is great for recycling,” Bottle and Can Return Center owner..."
Farrell welcomes Chinese investment in critical minerals,https://www.afr.com/world/north-america/farrell-welcomes-chinese-investment-in-critical-minerals-20231116-p5ekg0,2023. 11. 16.,날짜 없음,"The US is chasing Australian critical minerals, but Trade Minister Don Farrell says that shouldn't stop China from competing."
"Some of your nickels may be worth more than 5 cents, especially if they have this animal",https://www.kxan.com/news/national-news/some-of-your-nickels-may-be-worth-more-than-5-cents-especially-if-they-have-this-animal/,2023. 11. 13.,날짜 없음,"MINDENMINES, Mo. (KSNF) — Throughout the history of the United States Mint, many different designs have made their way onto American coins, but few of them..."
Toyota is turning to startup Redwood Materials for critical battery materials,https://techcrunch.com/2023/11/16/toyota-turning-to-redwood-materials-critical-battery-materials-us-factory/,2023. 11. 16.,날짜 없음,Redwood Materials will supply Toyota with materials for battery cells produced at the automaker's $13.9 billion North Carolina factory.
10 Largest Cobalt Mining Companies and Their Mines in the World,https://finance.yahoo.com/news/10-largest-cobalt-mining-companies-211117824.html,2023. 11. 20.,날짜 없음,This article will discuss the leading cobalt extraction companies and their operational footprint. If you want to skip our overview of the major moves and...
Electric car battery prices are going back down faster than expected,https://electrek.co/2023/11/20/electric-car-battery-prices-are-going-back-down-faster/,2023. 11. 20.,날짜 없음,Goldman Sachs Research now expects battery prices to fall to $99 per kilowatt hour (kWh) of storage capacity by 2025 — a 40% decrease from 2022...
The promise and risks of deep-sea mining,https://www.reuters.com/graphics/MINING-DEEPSEA/CLIMATE/zjpqezqzlpx/,2023. 11. 15.,날짜 없음,A vast treasure of critical minerals lies on the ocean floor. Should they be extracted to help fight climate change?
Darlot does it for Red 5,https://www.miningmonthly.com/underground/news-articles/1461926/darlot-red,2023. 11. 13.,날짜 없음,Red 5 enjoyed a profitable September quarter at Darlot after transitioning the former satellite mine into feedstock for the King of the Hills processing hub.
IGO board grilled over dud Western Areas takeover,https://thewest.com.au/business/mergers-and-acquisitions/igo-shareholders-demand-answers-on-disastrous-13-billion-western-areas-takeover-c-12573345,2023. 11. 16.,날짜 없음,"IGO bought the smaller nickel rival in 2022 for $1.3 billion, only to write off $980m on the deal just a year later."
"Meet Volvo’s new fully-electric premium MPV, the EM90",https://www.zigwheels.my/car-news/meet-volvos-new-fully-electric-premium-mpv-the-em90,2023. 11. 15.,날짜 없음,"Volvo has yanked the silks off its fully electric premium MPV, the EM90. The Volvo EM90 is now available for pre-orders in China at a starting price of RMB..."
