제목,링크,출처,날짜,설명
"BNC warns shareholders, potential investors",https://www.chronicle.co.zw/bnc-warns-shareholders-potential-investors/,2024. 4. 2.,날짜 없음,"Listed nickel mining concern, Bindura Nickel Corporation (BNC) has warned its shareholders and potential investors that it projects a material decline in..."
More gasoline price hikes on way for Prince George,https://www.princegeorgecitizen.com/local-news/more-gasoline-price-hikes-on-way-for-prince-george-8553037,2024. 4. 4.,날짜 없음,Prince George motorists were hit with another five-cent-per-litre hike in gas prices on Thursday.
Defining Precisely What is 'Downstream' Activity for Indonesia?,https://en.tempo.co/read/1850760/defining-precisely-what-is-downstream-activity-for-indonesia,2024. 3. 28.,날짜 없음,"Indonesia must prioritize expanded downstream policies in natural resource sectors with a bigger impact on small businesses, the environment, etc."
Conservative MP's hold 'Spike the Hike' rallies ahead of federal carbon price increase,https://www.cbc.ca/news/canada/sudbury/conservative-mp-federal-carbon-price-rally-1.7158945,2024. 3. 28.,날짜 없음,Federal Conservative Members of Parliament are holding rallies outside of Liberal MPs' offices in opposition to the impending increase of the federal carbon...
Allan Kelly’s Miramar Resources raising $1.7m to wheel into Bangemall and Gidji exploration projects,https://stockhead.com.au/resources/allan-kellys-miramar-resources-raising-1-7m-to-wheel-into-bangemall-and-gidji-exploration-projects/,2024. 4. 4.,날짜 없음,WA-focused Miramar Resources will raise approximately $1.7m to progress exploration work as it looks to prove up critical minerals and gold deposits.
"Vale Indonesia targets 2024 output of about 70,800 metric tons nickel in matte",https://www.mining.com/web/vale-indonesia-targets-2024-output-of-about-70800-metric-tons-nickel-in-matte/,2024. 4. 1.,날짜 없음,"Nickel miner PT Vale Indonesia is aiming for output this year of about 70,800 metric tons of nickel in matte, an official said on Monday, a similar volume..."
Perth Glory price tag revealed in court,https://thewest.com.au/business/administration-and-liquidation/perth-glory-rescue-cost-just-1-upfront-supreme-court-told--c-14155412,2024. 4. 1.,날짜 없음,The remarkable price tag to save Perth's A-League club from the financial doldrums has been revealed — but the costs are only just beginning.
"Green premiums are real, says aluminium boss",https://www.afr.com/companies/manufacturing/green-premiums-are-real-says-aluminium-boss-20240321-p5febv,2024. 4. 2.,날짜 없음,Electric vehicle makers are refusing to pay a green premium for low-carbon nickel but Capral says customers are paying an extra 5 per cent for clean...
Indonesian coal miner Harum Energy buys stake in nickel plant,https://www.mining.com/web/indonesian-coal-miner-harum-energy-buys-stake-in-nickel-plant/,2024. 4. 1.,날짜 없음,"PT Harum Energy has bought a controlling stake in a nickel processing plant, part of a trend of Indonesian coal miners moving into metals vital to the energy..."
Greenbushes owners trouser $6b in lithium dividends,https://thewest.com.au/business/mining/greenbushes-owners-talison-and-albemarle-pocket-6b-in-dividends-as-production-surge-offsets-price-slump-c-14154935,2024. 3. 31.,날짜 없음,The owners of the rich Greenbushes lithium mine have pocketed more than $6 billion in dividends after posting one of the biggest profits recorded in WA by a...
Hwange engages Chinese firm to rebuild coke battery,https://www.herald.co.zw/hwange-engages-chinese-firm-to-rebuild-coke-battery/,2024. 4. 3.,날짜 없음,"Hwange Colliery Company Limited has contracted a Chinese company to rebuild its coke oven battery, which was decommissioned in 2014 due to high operational..."
"Cheap coal, cheap workers, Chinese money: Indonesia’s nickel success comes at a price",https://www.theguardian.com/world/2024/apr/11/cheap-coal-cheap-workers-chinese-money-indonesias-nickel-success-comes-at-a-price,2024. 4. 12.,날짜 없음,"Indonesia sits on the world's largest reserves of nickel but the concentration in the ore is very low. Refining it to battery quality, or even just to make..."
Stainless Steel Market Sees Mixed Signals Amid Falling Nickel Prices,https://oilprice.com/Metals/Commodities/Stainless-Steel-Market-Sees-Mixed-Signals-Amid-Falling-Nickel-Prices.html,2024. 4. 8.,날짜 없음,Stainless Steel Market Sees Mixed Signals Amid Falling Nickel Prices · Nickel prices experienced a short-lived rally but later fell due to a bearish outlook and...
Mining billionaire Forrest urges China to demand greener nickel,https://www.ft.com/content/55bf165b-ede6-44d6-a9cd-e8a36bc20ffc,2024. 4. 6.,날짜 없음,Australian mining billionaire Andrew Forrest has called on China to demand higher environmental standards from its global supply chain.
Nickel market faces surplus as Indonesia and Philippines boost output,https://smallcaps.com.au/nickel-market-faces-surplus-indonesia-philippines-boost-output/,2024. 4. 9.,날짜 없음,the strong supply growth in recent years — predominantly from Indonesia and China — has created a global nickel surplus that is expected to persist over the...
Denarius sees quick restart for former Lundin nickel-copper mine in Spain,https://www.mining.com/denarius-looks-to-reopen-aguablanca-nickel-copper-mine-in-spain/,2024. 4. 11.,날짜 없음,Denarius Metals (CBOE: DMET) has released a prefeasibility study that supports the reopening of its 50%-owned Aguablanca nickel-copper mine in Spain.
Commodity prices inched up in March—Pink Sheet,https://blogs.worldbank.org/en/opendata/commodity-prices-inched-up-in-march-pink-sheet,2024. 4. 8.,날짜 없음,"I have read the Privacy Notice and consent to my personal data being processed, to the extent necessary, to submit my comment for moderation."
US Imposes Sanctions on Use of Russian Metals on Exchanges,https://www.bloomberg.com/news/articles/2024-04-12/us-imposes-sanctions-on-use-of-russian-metals-on-exchanges,2024. 4. 12.,날짜 없음,"The US and UK imposed new restrictions on trading Russian aluminum, copper and nickel that will reverberate across global metal markets."
More curtailments to come amid battery metal price slump,https://www.crugroup.com/en/communities/thought-leadership/2024/more-curtailments-to-come-amid-battery-metal-price-slump/,2024. 4. 10.,날짜 없음,"A global supply glut is forcing battery metal miners to rethink their production plans. Despite several curtailments, the outlook for marginal producers..."
"US, UK take action targeting Russian aluminum, copper and nickel",https://www.reuters.com/world/us/us-takes-action-targeting-russian-aluminum-copper-nickel-2024-04-12/,2024. 4. 12.,날짜 없음,"Washington and London on Friday prohibited metal-trading exchanges from accepting new aluminum, copper and nickel produced by Russia and barred the import..."
Changes coming to Nickel Beach parking,https://www.niagarathisweek.com/news/council/changes-coming-to-nickel-beach-parking/article_01b684d1-d86b-51f7-a433-224bbcc35e35.html,2024. 4. 12.,날짜 없음,"With summer on the way, Port Colborne is tinkering with how it operates parking at Nickel Beach. Among changes, 26 parking spots will be removed along Lake..."
Concerned shareholder offers to buy Sherritt shares,https://resourceworld.com/concerned-shareholder-offers-to-buy-sherritt-shares/,2024. 4. 8.,날짜 없음,"The company has received an offer to purchase 21.62 million of its common shares from SC2 Inc., sending the share price up 4.8% or $0.015 to 32.5 cents."
The one big problem getting to critical mineral independence - low metal prices,https://www.kitco.com/news/article/2024-04-09/one-big-problem-getting-critical-mineral-independence-low-metal-prices,2024. 4. 9.,날짜 없음,"(Kitco News) - Western governments have made strides in securing their own supply of rare earths, but there is still more work to do, said Luisa Moreno,..."
"Stamp prices poised to rise again, for the 2nd time this year",https://www.cbsnews.com/news/usps-prices-increase-forever-stamp-2024/,2024. 4. 10.,날짜 없음,"The US Postal Service is signaling that the price of a First-Class Mail Forever stamp will increase to 73 cents on July 14, 2024, up by a nickel from the 68..."
Shock WA mine asbestos finding throws doubt on tests,https://thewest.com.au/business/mining/more-needs-to-be-done-after-asbestos-detection-at-bhp-nickel-wests-mt-keith-clashes-with-worksafe-result-c-14247839,2024. 4. 11.,날짜 없음,"WorkSafe says asbestos levels at BHP Nickel West's Mt Keith nickel operation do not exceed safe limits, but independent testing suggests otherwise."
Critical mineral market volatility and what it means for Australia,https://www.australianresourcesandinvestment.com.au/2024/04/05/critical-mineral-market-volatility-and-what-it-means-for-australia/,2024. 4. 5.,날짜 없음,"Australian producers are grappling with a sudden collapse in critical mineral prices, with lithium falling over 80 per cent since January 2023 and nickel..."
Industrial metal prices jump as investors bet on rising China demand,https://www.ft.com/content/4fa142a5-faa2-425a-9c37-b636d9c30cdc,2024. 4. 11.,날짜 없음,"Zinc, copper and nickel outperform stocks as signs of resurgent demand add to fears about supply constraints."
Eramet reaches agreement to continue SLN’s New Caledonia operations,https://www.mining.com/web/eramet-faces-mine-stoppage-in-latest-new-caledonia-snag/,2024. 4. 10.,날짜 없음,Its nickel subsidiary SLN is locked in a dispute with local authorities over financial guarantees.
Canada Nickel kicks off work at Crawford nickel project,https://www.mining.com/canada-nickel-starts-working-on-crawford-eyes-2027-production/,2024. 4. 11.,날짜 없음,"Canada Nickel (TSX-V: CNC) has kicked off front end engineering design (FEED) at its flagship Crawford nickel project in northern Ontario, which it expects to..."
Westgold to buy Karora Resources in $808 million deal,https://www.mining.com/web/westgold-to-buy-karora-resources-in-808-million-deal/,2024. 4. 8.,날짜 없음,The deal will propel the combined group to become a mid-tier gold miner producing around 400000 ounces of gold a year.
Own ASX 200 mining shares? Here's the 5-year forecast for commodity prices,https://www.fool.com.au/2024/04/05/own-asx-200-mining-shares-heres-the-5-year-forecast-for-commodity-prices/,2024. 4. 5.,날짜 없음,The prices of ASX 200 mining and energy shares are directly impacted by commodity values every day. Here are the new price forecasts.
What are electric car batteries made of?,https://www.edmunds.com/electric-car/articles/what-are-electric-car-batteries-made-of.html,2024. 4. 5.,날짜 없음,"Most electric car batteries are made of varying quantities of lithium-ion, cobalt, nickel, manganese, silicon and electrolytes."
National Coin Week is approaching. See most valuable coins in U.S. in 2024,https://www.courier-journal.com/story/news/2024/04/09/national-coin-week-see-how-much-your-coins-change-is-worth-in-2024/73258903007/,2024. 4. 9.,날짜 없음,"It might not be the Powerball jackpot, but your pocket change could earn you a fortune. Pull out your old piggy banks and search your couch cushions,..."
"Lee’s Confectionery Reopens As Nickel, A Minimalist Cafe With Nett Prices",https://eatbook.sg/nickel-cafe/,2024. 4. 12.,날짜 없음,"Nickel is a cosy cafe with gorgeous desserts in Rochor ... Previously known as Lee's Confectionery, Nickel is a cosy cafe tucked away in a corner along Middle..."
Nickel surges 5% on tighter supply concerns,https://www.xtb.com/int/market-analysis/news-and-research/nickel-surges-5-on-tighter-supply-concerns,2024. 4. 19.,날짜 없음,Nickel prices are recording a strong rally and futures contracts are already approaching the vicinity of $19.5000 per ton.
Nornickel says new Western sanctions raise risk of metals market disruption,https://www.mining.com/web/nornickel-says-new-western-sanctions-raise-risk-of-metals-market-disruption/,2024. 4. 16.,날짜 없음,"US and British sanctions imposed on Russian nickel, copper and aluminum will further increase price volatility and supply uncertainty."
"Nickel ore in scarce supply, soon nickel pig iron too?",https://steelnews.biz/nickel-ore-in-scarce-supply-soon-nickel-pig-iron-too/,2024. 4. 16.,날짜 없음,Scarce availability of Indonesian and Philippine nickel ore leads to empty warehouses at Asian smelters. Impact on nickel pig iron to be expected soon?
Aluminium and nickel prices jump after sanctions on Russian supply,https://www.ft.com/content/e6e47a90-0b1f-41ac-9e70-f440e64d1463,2024. 4. 15.,날짜 없음,UK and US measures ban delivery of new Russian-origin metals to LME and CME.
Horizonte Minerals halts US$1bn Brazil nicke...,https://www.bnamericas.com/en/analysis/horizonte-minerals-halts-us1bn-brazil-nickel-project,2024. 4. 17.,날짜 없음,"London-listed exploration company Horizonte Minerals failed to arrange a financing solution for its US$1bn Araguaia nickel project in Pará state, northern..."
What new metal sanctions on Russia mean for global trade,https://think.ing.com/articles/what-do-the-new-russian-metal-sanctions-mean-for-global-trade/,2024. 4. 15.,날짜 없음,"No Russian nickel, aluminium and copper produced from 13 April onwards will be eligible for delivery to the LME or the Chicago Mercantile Exchange (CME)."
China’s domestic stainless steel prices rise following metal sanctions on Russia,https://www.fastmarkets.com/insights/chinas-domestic-stainless-steel-prices-rise-following-metal-sanctions-on-russia/,2024. 4. 18.,날짜 없음,Domestic stainless steel prices in China rose in the week to Wednesday April 16 following expectations of an increase in nickel prices on the back of fresh...
Glencore nickel production 2023,https://www.statista.com/statistics/728097/nickel-production-glencore/,2024. 4. 19.,날짜 없음,"During the fiscal year 2023, the Swiss-based company Glencore reported a nickel production of some 97.6 thousand metric tons."
"Metals Spike on LME After Russian Supply Hit by US, UK Sanctions",https://www.bloomberg.com/news/articles/2024-04-15/metals-spike-on-lme-after-russian-metal-hit-by-us-uk-sanctions,2024. 4. 15.,날짜 없음,"Metals swung sharply, with aluminum surging by a record before later erasing most of its gains, as traders digest US and UK sanctions that banned delivery..."
"BHP Results: The long, nervous wait to see if Nickel West survives continues",https://stockhead.com.au/resources/bhp-results-the-long-nervous-wait-to-see-if-nickel-west-survives-continues/,2024. 4. 18.,날짜 없음,"BHP delivers 'mixed result' with copper and iron ore on track to hit guidance but met coal in struggle town; Nickel business mystery continues, as BHP sets..."
"Base metal prices surge as new sanctions target Russian nickel, copper and aluminium",https://smallcaps.com.au/global-base-metal-prices-surge-sanctions-russian-nickel-copper-aluminium/,2024. 4. 17.,날짜 없음,"Base metal prices surge as new sanctions target Russian nickel, copper and aluminium ... Global demand for a number of base metals including nickel, copper and..."
"LME, Comex ordered to restrict Russian metals trading",https://www.recyclingtoday.com/news/copper-aluminum-nickel-russia-bans-restrictions-lme-comex/,2024. 4. 14.,날짜 없음,"The U.S. Treasury Department says the action is intended to “disrupt the revenue that Russia earns from its export of aluminum, copper and nickel.”"
BHP suffers new productivity hit in Queensland coal,https://www.afr.com/companies/mining/bhp-suffers-new-productivity-hit-in-qld-coal-20240418-p5fkpi,2024. 4. 18.,날짜 없음,BHP may wait until August before clarifying the future of its troubled Australian nickel business after ruling off a quarter undermined by downgraded...
Indonesia’s grand ambition to become an EV leader rests on nickel mining boom,https://www.nationalobserver.com/2024/04/19/news/fate-indonesia-ev-ambitions-nickel-mining-boom,2024. 4. 19.,날짜 없음,"Indonesia's comfortable position as the world's biggest, low-cost nickel producer has failed to translate into power to call for higher environmental and..."
Nickel demand worldwide 2019-2023,https://www.statista.com/statistics/273653/global-nickel-demand/,2024. 4. 19.,날짜 없음,"In 2021, the global demand for nickel amounted to some 2.86 million metric tons."
Glencore-backed nickel miner fails to secure financing after rising costs,https://www.ft.com/content/17540fd1-b2f7-4e73-93b1-339c3b7b45cb,2024. 4. 15.,날짜 없음,Horizonte Minerals looking at sale of Brazilian nickel mine as investors fear Indonesia is flooding the market.
"Horizonte Minerals fails to secure financing, considering mine sale",https://www.mining.com/horizonte-minerals-fails-to-secure-financing-after-rising-costs-shares-plunge/,2024. 4. 15.,날짜 없음,The company considers selling its Brazilian nickel mine amidst low prices and supply surplus from Indonesia.
Share of U.S. nickel imports by country 2019-2022,https://www.statista.com/statistics/260834/share-of-us-nickel-imports-by-country/,2024. 4. 19.,날짜 없음,"Between 2019 and 2022, approximately 40 percent of all nickel imports into the United States came from Canada."
"BHP to decide on future of nickel business by August, trims met coal estimates",https://www.mining.com/web/bhps-iron-ore-output-rises-still-reviewing-plans-for-nickel-ops/,2024. 4. 17.,날짜 없음,"BHP Group on Thursday said it expects to announce the fate of its Western Australian nickel operations by August, while it trimmed fiscal 2024 output estimates."
Nickel: global leading companies by production 2022,https://www.statista.com/statistics/260812/leading-nickel-miners/,2024. 4. 18.,날짜 없음,"Russian mining company Norilsk Nickel, also known as Nornickel, was the world's largest nickel producer as of the first quarter (Q1) of 2021 and Q1 2022,..."
Metal Traders Get Ready for Fireworks After LME Russia Ban,https://www.livemint.com/news/world/metal-traders-get-ready-for-fireworks-after-lme-russia-ban-11713118340081.html,2024. 4. 14.,날짜 없음,Metal traders are bracing for dramatic moves after the London Metal Exchange responded to new US and UK sanctions by banning deliveries of any Russian supplies.
INSG's latest forecasts cold comfort for nickel producers,https://www.reuters.com/markets/commodities/insgs-latest-forecasts-cold-comfort-nickel-producers-2024-04-25/,2024. 4. 25.,날짜 없음,"Nickel has rallied hard this month, clawing back some of the territory lost during its relentless price slide over the course of 2023."
The nickel price crash and the road to recovery in Australia,https://www.mining-technology.com/features/nickel-price-crash-australia-crisis-recovery/,2024. 4. 23.,날짜 없음,"In January, First Quantum announced plans to cut production and slash the workforce at its Raventhorpe nickel mine in Australia after it posted an operating..."
A new dash for copper is underway – how will it play out? Expert Q&A,https://theconversation.com/a-new-dash-for-copper-is-underway-how-will-it-play-out-expert-qanda-228811,2024. 4. 26.,날짜 없음,Australian mining giant BHP has kicked off a new round of mergers by bidding for Anglo American.
Low nickel prices restrict market,https://magazine.cim.org/en/news/2024/low-nickel-prices-restrict-market-en/,2024. 4. 23.,날짜 없음,Low nickel prices restrict market Nickel miners all over the world forced to close operations and cut production due to oversupply of nickel from Indonesia.
Archer Exploration changes name to NorthX Nickel,https://www.mining.com/archer-exploration-changes-name-to-northx-nickel/,2024. 4. 26.,날짜 없음,It will also change its name to “NorthX Nickel Corp.” and expects to commence trading on the CSE under the new trading symbol “NIX” the same day.
"Canada and allies considering trade measures against China and Indonesia over manipulation of nickel market, Freeland says",https://www.theglobeandmail.com/business/article-canada-and-allies-considering-trade-measures-against-china-and/,2024. 4. 23.,날짜 없음,Deputy Prime Minister Chrystia Freeland says Canada and its allies are weighing taking trade action against China and Indonesia in the nickel market.
WA nickel gloom persists after price hits seven-month highs,https://thewest.com.au/business/mining/key-nickel-players-in-wa-unmoved-by-recent-price-spike-to-levels-not-seen-since-september-c-14427798,2024. 4. 28.,날짜 없음,"BHP's H1 FY22 accounts revealed Nickel West was generating positive underlying earnings at an average realised price of $US19,651/t, but inflationary pressures..."
Top 9 Nickel-producing Countries,https://investingnews.com/daily/resource-investing/base-metals-investing/nickel-investing/top-nickel-producing-countries/,2024. 4. 22.,날짜 없음,"Indonesia, the Philippines and New Caledonia are the top nickel countries by production. Explore the top nine nickel mining countries here."
"Cobalt Crunch: Prices Plummet, Supply Challenges Loom in the Race to Net Zero",https://carboncredits.com/cobalt-crunch-prices-plummet-supply-challenges-loom-in-the-race-to-net-zero/,2024. 4. 24.,날짜 없음,"Cobalt prices have plummeted to pre-2021 levels since the beginning of the year, with analysts predicting a continued decline."
"Should the U.S. Mint stop making the cent and nickel coins, which are currently produced at a financial loss? Why or why not?",https://www.numismaticnews.net/collecting-101/should-the-u-s-mint-stop-making-the-cent-and-nickel-coins-which-are-currently-produced-at-a-financial-loss-why-or-why-not,2024. 4. 26.,날짜 없음,"No, the US Mint should not stop making cent and nickel coins. Despite being produced at a financial loss, we need them to make accurate change or pay for a..."
Daughter of Chinese steel-and-nickel tycoon picks up S$84 million Bin Tong Park bungalow,https://www.businesstimes.com.sg/property/residential/daughter-chinese-steel-and-nickel-tycoon-picks-s-84-million-bin-tong-park-bungalow,2024. 4. 24.,날짜 없음,The daughter of China-born steel-and-nickel magnate Xiang Guangda has become the owner of a large brand-new bungalow in the Bin Tong Park Good Class Bungalow (...
The Metals Company provides update on nickel sulfate derived from seafloor polymetallic nodules,https://www.canadianmanufacturing.com/manufacturing/the-metals-company-provides-update-on-nickel-sulfate-derived-from-seafloor-polymetallic-nodules-299009/,2024. 4. 24.,날짜 없음,"The sulfate was generated during bench-scale testing of its hydrometallurgical flowsheet design in partnership with SGS Canada Inc., at their Lakefield,..."
‘Challenging to fund’: Focus shifts from NQ battery project,https://www.townsvillebulletin.com.au/business/townsville-business/qpm-shifts-focus-away-from-townsville-energy-chemicals-hub-project/news-story/390e2e86fe2158e0b4aa61705402dc2d,2024. 4. 25.,날짜 없음,"Queensland Pacific Metals, the company behind a $2.1bn battery metals refinery project at the Lansdown Eco Industrial precinct, has announced it is shifting..."
Explainer: Will base metals prices continue their upward ride?,https://www.financialexpress.com/commodities-2/explainer-will-base-metals-prices-continue-their-upward-ride/3466407/,2024. 4. 24.,날짜 없음,"Prices of key industrial metals such as copper, aluminium and zinc have soared in the last few months, reaching fresh multi-year highs."
Chinese nickel billionaire boosts Australian miner in Indonesia,https://www.mining.com/web/chinese-nickel-billionaire-boosts-australian-miner-in-indonesia/,2024. 4. 22.,날짜 없음,"In under a decade, Nickel Industries Ltd. has gone from a relatively small miner to the world's sixth-biggest producer of the metal."
Ravensthorpe latest WA nickel victim with 530 jobs to go,https://thewest.com.au/business/mining/first-quantum-minerals-ravensthorpe-nickel-mine-to-be-put-on-care-and-maintenance-330-jobs-to-go-c-14480926,2024. 4. 28.,날짜 없음,Another WA nickel domino has fallen to the ongoing price bloodbath as 530 local roles from the Ravensthorpe mine get wiped out.
LME finds Russian sanctions come with an aluminium twist,https://www.reuters.com/markets/commodities/lme-finds-russian-sanctions-come-with-an-aluminium-twist-2024-04-23/,2024. 4. 23.,날짜 없음,It didn't take very long for someone to work out a way of making money from the London Metal Exchange's (LME) new rules around Russian metals.
"Power Nickel earns 80% of Nisk project in Quebec, adds polymetallic zone",https://www.mining.com/power-nickel-earns-80-of-nisk-project-in-quebec-adds-polymetallic-zone/,2024. 4. 24.,날짜 없음,Power Nickel (TSXV: PNPN) increased its ownership of the Nisk project to 80% from Critical Elements Lithium (CRE: TSXV) and reported new drill results from a...
WA nickel mine and Kwinana facility get $69m free kick,https://thewest.com.au/business/renewable-energy/murrin-murrin-nickel-mine-and-wesfarmers-kwinana-facility-receive-69m-clean-energy-gift-from-federal-labor-c-14411175,2024. 4. 23.,날짜 없음,Corporate giants Glencore and Wesfarmers are big beneficiaries of a $330 million funding initiative by the Albanese Government for clean energy projects.
"Huayou cuts lithium production, costs on battery metals rout",https://www.mining.com/web/huayou-cuts-lithium-production-costs-on-battery-metals-rout/,2024. 4. 22.,날짜 없음,Zhejiang Huayou Cobalt Co. said it has reduced lithium output and cut costs after reporting a 49% slump in net income in the first quarter.
Tesla expects its 4680 battery cells to be cheaper than suppliers by end of year,https://electrek.co/2024/04/24/tesla-expects-4680-battery-cells-cheaper-than-suppliers-end-of-year/,2024. 4. 24.,날짜 없음,Tesla now says that it expects its own 4680 battery cells to become cheaper than those coming from suppliers by the end of the year.
